2/13/25 0:11,2/13/25 0:27,193.166.113.20,1000,R_8cOxwpIBwYtJec9,63.1198,21.6798,0,0,10,44,1,2,1,1,"1,3","1,3,4",3,"2,4",13,11,4,1,2,2,1,Ġvisualize Ġand Ġinterpret Ġdata,Ġ Ä ł data Ġ Ä ł trie val Ġ Ä ł,data Ġ Ä ł aly s Ġ Ä ł Ġ Ä ł m p roving Ġ Ä ł accuracy Ġ Ä ł,Ġidea,0,2025-02-13 10:07:39,2025-02-13 10:33:08,193.166.113.20,1528,R_2zedcpIQkLX8HZF,63.1198,21.6798,0,0,"Ġcollect Ġdemographic Ġdata Ġincluding Ġage , Ġgender , Ġtheir Ġma jor s . ĠThe ir Ġbehavioral Ġdata Ġsuch Ġas Ġengagement Ġwith Ġcourse . ĠQ ualitative Ġdata Ġcan Ġalso Ġbe Ġcollected Ġvia Ġinterviews , Ġsurveys Ġ","Ġcan Ġcategor ize Ġstudents Ġby Ġtheir Ġlearning Ġstyles , Ġgoals , Ġbackgrounds . Ġ Ġcan Ġapply Ġstatistical Ġtechniques Ġ","P ro f ile Ġincludes Ġname , Ġimage , Ġbackground , Ġcommunic ation Ġchan n el s Ġ","fter Ġsegmentation Ġwe Ġcan Ġstart Ġbuilding Ġpersonas Ġbased Ġon Ġstudents Ġprofiles . ĠF oll owing Ġsteps Ġare Ġneeded Ġto Ġcr et e Ġpersona Ġprofiles Ġa ) Ġdata Ġcollection , Ġb ) Ġsegmentation , Ġ Ġc ) Ġpersona Ġmod el ing , Ġd ) Ġvalidation",4,3,All of the above,0,1,0,0,"d es ign ing Ġvisually Ġappealing Ġpersona Ġprofiles , Ġimages Ġand Ġvisuals",Ġcommunicate Ġand Ġshare Ġdata,Ġcreate Ġdynamic Ġdata Ġdriven Ġpersonas Ġ,7,7,6,6,5,4,7,2,7,5
2/13/25 0:09,2/13/25 0:28,193.166.113.14,1124,R_8KYZgliXIYeFR3m,63.1198,21.6798,0,0,3,44,2,2,2,1,"1,4","1,4","1,2,3,4","2,3,4",13,11,4,1,2,2,1,Ġdata Ġanalysis Ġand Ġprocess ing,"Ġ Ä ł don Ġ ' t Ġ Ä ł ful ly Ġ Ä ł u nders tand Ġ Ä ł Ġ Ä ł qu est ion Ġ Ä ł o f Ġ Ä ł wh y Ġ Ä ł Ġ Ä ł w ould Ġ Ä ł use Ġ Ä ł PI s Ġ Ä ł Ġ Ä ł c ate Ġ Ä ł Ġ Ä ł persona Ġ ? Ġ Ä ł P rob ably Ġ Ä ł c ause Ġ Ä ł Ġ Ä ł w ould Ġ Ä ł Ġ Ä ł able Ġ Ä ł Ġ Ä ł m o ve Ġ Ä ł data Ġ Ä ł n m bly Ġ Ä ł f rom Ġ Ä ł Ġ Ä ł data base Ġ Ä ł Ġ Ä ł Ġ Ä ł ap pl ication Ġ Ä ł t hat Ġ Ä ł c Ġ Ä ł aly z e Ġ Ä ł Ġ Ä ł inter pre t Ġ Ä ł Ġ Ä ł data Ġ , Ġ Ä ł Ġ Ä ł f rom Ġ Ä ł th ere Ġ Ä ł Ġ Ä ł Ġ Ä ł PI Ġ Ä ł Ġ Ä ł Ġ Ä ł Ġ Ä ł th Ġ Ä ł formation Ġ Ä ł c Ġ Ä ł Ġ Ä ł ut il ized Ġ .",Machine Ġ Ä ł le arning Ġ Ä ł ma kes Ġ Ä ł b uil ding Ġ Ä ł data Ġ- Ġbased Ġ Ä ł p ersonas Ġ Ä ł m o Ġ Ä ł e fficient Ġ Ä ł th Ġ Ä ł fo Ġ .,Ġf ar Ġas ĠI Ġknow Ġthey Ġhave Ġbeen Ġcrit ic ed Ġfor Ġcreating Ġstereotypical Ġf ig ures .,0,2025-02-13 0:55:37,2025-02-13 1:16:41,193.166.113.14,1264,R_8aabHRu9hpW6k7x,63.1198,21.6798,0,0,"S urvey s : Ġstudents Ġcan Ġf ill Ġout Ġan Ġin ial Ġsurvey Ġto Ġlearn Ġabout Ġtheir Ġbackground Ġand Ġgoals Ċ n alytics Ġdata : Ġthe Ġlearning Ġplatform ĠMoodle Ġcan Ġgener ate Ġdata Ġon Ġstudent Ġactivity Ġand Ġassignment Ġsub m iss ions Ċ D iscussions Ġand Ġreflect ions : Ġstudent Ġres p ses Ġin Ġfor um s , Ġclasses Ġor Ġcourse Ġassignments Ġcan Ġprovide Ġvaluable Ġinsi ght Ġinto Ġpersonal ity Ċ S o cial Ġmedia Ġprofiles Ġ ( Ġallow ed ) : ĠL inked Ġprofiles Ġand Ġother Ġp u b l ic Ġdata Ġcan Ġhelp Ġunderstand Ġstudent Ġinterests","Based Ġon Ġthe Ġdata , Ġstudents Ġcan Ġbe Ġsegmented Ġaccording Ġto Ġvarious Ġvariables , Ġsuch Ġas : Ċ - Based Ġon Ġlearning Ġstyle Ċ - Based Ġon Ġmotiv ation Ġ Ċ - Based Ġon Ġprevious Ġexperience ĠĊ Ċ Ġexample , Ġusing Ġa Ġclustering Ġalgorithm : Ġm achine Ġlearning Ġmethods Ġsuch Ġas ĠK - means Ġcan Ġhelp Ġfind Ġnatural Ġgroups Ġin Ġdata","ce Ġthe Ġdata Ġh Ġbeen Ġanalyzed , Ġa Ġfe w Ġtypical Ġstudent Ġpersonas Ġcan Ġbe Ġform ed Ġthat Ġrese m ble Ġa Ġreal Ġperson , Ġa Ġpersona Ġthat , Ġhowever , Ġdoes Ġnot Ġfully Ġrepresent Ġany Ġnatural Ġperson . Ċ Ċ S uch Ġa Ġpersona Ġis Ġoften Ġgiven Ġa Ġname , Ġa Ġpicture , Ġage , Ġetc . Ġdemographic Ġcharacteristics , Ġas Ġwell Ġas Ġh o b b ies Ġand Ġinterests . ĠInformation Ġthat Ġcan Ġbe Ġin fer d Ġbased Ġon Ġthe Ġanalyzed Ġdata .","Ġpersonas Ġcreated Ġshould Ġbe Ġvalidated , Ġi . e . Ġchecked Ġto Ġsee Ġhow Ġaccurate Ġand Ġuseful Ġthey Ġactually Ġare . ĠV al d ation Ġcan Ġbe Ġdone , Ġfor Ġexample , Ġthrough ĠA / B Ġtesting . ĠIn Ġa Ġclassroom Ġsituation , Ġit Ġcan Ġalso Ġbe Ġdone Ġthrough Ġa Ġfeedback Ġsurvey . ĠD ynamic Ġpersonas Ġare Ġun like ly Ġto Ġbe Ġcreated Ġfrom Ġstudents , Ġso Ġthe Ġpersonas Ġcreated Ġwill Ġbecome Ġoutdated Ġover Ġtime Ġif Ġthey Ġare Ġnot Ġupdated .",5,5,"Social media analytics,Surveys and interviews,Behavioral data from apps,All of the above",0,1,0,0,"V isual ization Ġand Ġpresent ation , Ġboth Ġtools Ġallow Ġfor Ġclear , Ġvisually Ġappealing Ġrepresentations Ġof Ġpersonas , Ġincluding Ġimages , Ġdemographic Ġdata , Ġgoals , Ġand Ġbehaviors .","PI s Ġcan Ġbe Ġvaluable Ġin Ġpersona Ġdevelopment Ġbecause Ġthey Ġallow Ġfor Ġautom ated Ġdata Ġcollection , Ġintegration Ġand Ġanalysis .","Machine Ġlearning Ġalgorithms Ġcan Ġbe Ġused Ġin Ġpersona Ġdevelopment Ġfor Ġvarious Ġpurposes , Ġmaking Ġthe Ġprocess Ġmore Ġdata - driven , Ġaccurate Ġand Ġad ap t ve .",4,1,6,4,4,4,3,2,2,4
2/13/25 0:10,2/13/25 0:29,193.166.125.254,1119,R_8r17PhHstZLqpke,63.0945,21.631,0,0,8,57,2,4,2,"I have more given inspiration lessons, not ""teaching"" ",2,"2,3,4",4,2,11,1,"1,2",2,2,4,5,Ġto Ġhelp Ġme Ġlearn Ġf aster Ġand Ġeasier,Ġ Ä ł Ġ Ä ł l p Ġ Ä ł m e Ġ Ä ł le arn Ġ Ä ł Ġ Ä ł f os ter Ġ Ä ł m e Ġ Ä ł st eps Ġ Ä ł ad,Ġ Ä ł l p Ġ Ä ł u nders tand ing Ġ Ä ł o f Ġ Ä ł le arning Ġ Ä ł t ks,"based Ġon Ġthe Ġinput , Ġyou Ġcan Ġcreate Ġv ery Ġnarr ow Ġbase Ġof Ġknow - ledge - & g t ; Ġf ake Ġnew s",0,2025-02-13 10:07:05,2025-02-13 10:27:37,193.166.125.254,1232,R_8ml05J8QAzhgil3,63.0945,21.631,0,0,"y ou Ġshould Ġcollect Ġsome Ġbackground Ġdata Ġsuch Ġas Ġtheir Ġage , Ġgender , Ġgeographic Ġlocation Ġ , Ġtheir Ġinterest Ġand Ġbehaviours Ġto Ġform Ġdifferent Ġperona / demographic Ġdata","based Ġon Ġthe Ġbackground Ġmaterials Ġyou Ġcan Ġfind Ġdifferent Ġsegments . Ġ Ġthey Ġhave Ġin Ġcommon Ġor Ġnot , Ġwhat Ġare Ġtheir Ġinter ets Ġand Ġbased Ġon Ġthat Ġyou Ġcan Ġdevelop Ġinteresting Ġmaterials Ġthat Ġ "" m ake Ġs en se "" Ġfor Ġtheir Ġinterest . Ġ Ġyou Ġare Ġinterested Ġin Ġs om et h ing , Ġyou Ġusually Ġlearn Ġeasier / ha vi r al Ġdata",based Ġon Ġthe Ġbackground Ġmaterial Ġyou Ġcan Ġcreate Ġdifferent Ġperona Ġprofiles . ĠI Ġneed Ġmore Ġinformation Ġon Ġhow Ġto Ġdo Ġit Ġtechn ically . Ġ/ psy h ograp ic Ġdata,Ġevaluating Ġyou Ġshould Ġtake Ġinto Ġconsid er ation Ġvalid r ity Ġand Ġiter ating Ġ/ q ualitative Ġinsights,3,2,"Social media analytics,Surveys and interviews,Behavioral data from apps,All of the above",0,1,0,0,Ġcan Ġvisually Ġcreate Ġmaterials Ġsh owing Ġa Ġpersona,Ġhel ps Ġme Ġcreate Ġp es ona Ġbased Ġon Ġa Ġlot Ġof Ġbackground Ġmaterials,Ġcan Ġcollect Ġa Ġlot Ġof Ġbackgrounds Ġdata Ġand Ġbased Ġon Ġthat Ġanalyze Ġo ch Ġcreate Ġpersona Ġprofiles,6,6,6,6,6,6,6,2,6,6
2/13/25 0:12,2/13/25 0:29,193.166.113.11,993,R_8YnVKnbBUAp5sKT,63.1198,21.6798,0,0,9,62,2,1,2,25,"1,2,3,4","1,2,3,4","3,4","2,3,4",10,1,5,5,5,5,5,Ġanswer,Ġ Ä ł ans w er,Ġ Ä ł ans w er,"l iability , Ġuse Ġfor Ġnon - et hical Ġpurposes .",0,2025-02-13 0:56:19,2025-02-13 1:27:01,193.166.113.11,1841,R_2EBkFOhnycAdZvb,63.1198,21.6798,0,0,Ġtask Ġis Ġto Ġdefine Ġtarget Ġaudience . ĠI Ġwould Ġuse Ġsurvey Ġ ( Ġclassroom Ġdiscussions ) Ġto Ġcollect Ġdata Ġfrom Ġm aster Ġpro gr Ġstudents .,Ġwould Ġuse Ġways Ġof Ġlearning Ġto Ġsegment Ġdata Ġand Ġmaybe Ġthe Ġgrade Ġstudents Ġare Ġaim ing Ġat .,"age , Ġgender , Ġways Ġof Ġlearning , Ġgrade Ġaim",f lect Ġon Ġclass Ġroom Ġdiscussions,2,2,"Social media analytics,Surveys and interviews,Behavioral data from apps,All of the above",0,1,0,0,Ġanswer,Ġpersona Ġbuilding,Ġevalu ate Ġaccuracy Ġof Ġpersonas,5,2,5,5,5,5,5,2,2,4
2/13/25 0:24,2/13/25 0:30,193.166.113.28,361,R_2CWeahLVoK3ZUft,63.1198,21.6798,0,0,40,47,2,2,1,10,"1,2,3,4","1,2,3,4",3,"3,4",10,1,"1,2,3,4",1,2,2,1,F ding Ġbehavioral Ġpatterns Ġin Ġvast Ġqu ant ities Ġand Ġcor rob ate Ġthem Ġfor Ġa Ġsystem ic Ġanalysis Ġand Ġsegmentation Ġbased Ġupon Ġthat,nt Ġ Ä ł k,Ġ Ä ł m o Ġ Ä ł formation Ġ Ä ł bout Ġ Ä ł se gm ents,Et hics,0,2025-02-13 10:07:11,2025-02-13 10:29:12,193.166.113.28,1321,R_2doVO2uJTfJPeCn,63.1198,21.6798,0,0,"Collecting Ġso Ġcalled Ġ "" b ig Ġdata "" Ġincludes Ġfor Ġexample Ġonline Ġsurveys , Ġuser Ġinteractions Ġor Ġanalytics Ġfrom Ġsocial Ġmedia Ġwe bs es , Ġand Ġallow s Ġfor Ġgathering Ġvast Ġamount Ġof Ġinformation Ġin Ġa Ġshort Ġtime Ġperiod . ĠI Ġassume Ġthere Ġis Ġno Ġlimit Ġto Ġhow Ġmuch Ġother Ġthan Ġthe Ġavaila bility Ġof Ġsources Ġand Ġsome Ġlevel Ġof Ġdata Ġs atur ation . Ġ","Ġfirst Ġstep Ġis Ġto Ġcreate Ġsegments Ġ ( demographics , Ġbehavioral , Ġpsychograp ich Ġetc . ) . ĠF rom Ġthere , Ġwe Ġcan Ġuse Ġso Ġcalled Ġclustering Ġalgorithms Ġfor Ġa Ġdeep er Ġanalysis Ġof Ġthe Ġfirst Ġsegmentation Ġ rou nd , Ġand Ġfrom Ġthere Ġstart Ġbuilding Ġidentities Ġ ( persona Ġbuilding ) . ĠAl l Ġthis Ġis Ġdone Ġwith Ġa Ġcomputer Ġof Ġcourse Ġ :) Ġ :) Ġ :) ĠĠ","Ġall Ġthe Ġsegmentation , Ġclustering Ġand Ġindividual ization Ġfor Ġthe Ġfirst Ġpersona Ġprot otyp es , Ġthey Ġneed Ġto Ġbe Ġtested Ġto Ġensure Ġthey Ġare Ġrelevant Ġand Ġinteresting Ġfor Ġthe Ġusers . ĠThis Ġcan Ġbe Ġdone Ġwith Ġusing Ġqualitative Ġresearch Ġinsights Ġas Ġwell Ġas Ġtesting Ġthem Ġon Ġthe Ġstudents Ġby Ġsurveys Ġor Ġsimilar Ġfeedback Ġgathering Ġactivities . ĠFinally , Ġwhen Ġthere Ġis Ġenough Ġinformation , Ġthese Ġpersonas Ġcan Ġbe Ġgiven Ġidentities Ġwith Ġcharacteristics Ġsuch Ġas Ġgender , Ġage , Ġface Ġand Ġb od y Ġetc .","Ġto Ġassess Ġthe Ġcredibility Ġand Ġrepresentativeness Ġof Ġpersonas ? Ġ Ċ Ġseem s Ġthat Ġthe Ġpersonas Ġcan Ġbe Ġtested Ġfor Ġinconsistencies Ġby Ġcomparing Ġthem Ġto Ġthe Ġexisting Ġdata . ĠAlso , Ġthe Ġperce ptions Ġof Ġthe Ġusers Ġis Ġimportant Ġhere , Ġas Ġthey Ġdec ide Ġhow Ġthey Ġrelated Ġto Ġthese Ġdata - driven Ġpersonas . ĠSo Ġare Ġthese Ġidentities Ġconsidered Ġrealistic Ġand Ġrelatable ? ĠFinally , Ġand Ġthis Ġt ies Ġto Ġthe Ġquestion Ġof Ġethics Ġas Ġwell , Ġit Ġis Ġimportant Ġto Ġfoll ow Ġthe Ġconstru ction Ġtim el ine . ĠThis Ġis Ġcalled Ġalgorithm Ġtr ans par enc y Ġand Ġme ans Ġprov d ing Ġa Ġclear Ġpicture Ġof Ġhow Ġthe Ġpersonas Ġwere Ġconstru cted . Ġ",2,2,All of the above,0,1,0,0,"Ġ "" p ain t Ġthe Ġpicture Ġof Ġthe Ġpersona "" Ġby Ġad ding Ġthe Ġch os en Ġcharacteristics Ġetc . Ġ",Maybe,Ġal read y Ġcluster Ġinformation Ġso ĠI Ġassume Ġthere Ġis Ġsome Ġlevel Ġof Ġsegmentation Ġavailable,5,5,6,4,2,5,5,2,4,3
2/13/25 0:10,2/13/25 0:30,193.166.113.40,1227,R_2tJ87BqRGW9MQgh,63.1198,21.6798,0,0,20,41,2,2,2,0,"1,2,3,4","3,4",3,"2,4",11,10,"1,2,3,4",1,3,2,1,Ġcan Ġcomb ine Ġdata Ġfrom Ġdifferent Ġd ets Ġand Ġthen Ġbe Ġused Ġfor Ġcreating Ġpersonas . ĠThe Ġdata Ġcan Ġalso Ġbe Ġmod ified Ġand Ġf il ter ed .,Ġ Ä ł d o es Ġ Ä ł PI Ġ Ä ł st Ġ Ä ł Ġ Ä ł h ere Ġ ?,"Ġ Ä ł c Ġ Ä ł c ate Ġ Ä ł Ġ Ä ł s ter e otypical Ġ Ä ł p erson Ġ Ä ł f rom Ġ Ä ł al gor ith ms Ġ . Ġ Ä ł l Ġ , Ġ Ä ł w ith Ġ Ä ł f oll owing Ġ Ä ł Ġ Ä ł ind ivid ual Ġ ' s Ġ Ä ł al gor ith ms Ġ , Ġ Ä ł Ġ Ä ł persona Ġ Ä ł o f Ġ Ä ł c ertain Ġ Ä ł p erson Ġ ' s Ġ Ä ł f e atures Ġ Ä ł c Ġ Ä ł Ġ Ä ł c ated Ġ .",S c s Ġcan Ġocc ur .,0,2025-02-13 10:06:57,2025-02-13 10:21:21,193.166.101.194,864,R_2eggtuOjvDzt8YS,63.1092,21.5936,0,0,"Ġmuch Ġdata Ġas Ġpossible Ġshould Ġbe Ġcollected , Ġand Ġthe Ġdata Ġshould Ġbe Ġupdated Ġregularly . ĠThe Ġamount Ġshould Ġbe Ġbig Ġand Ġsignificant . ĠData Ġis Ġcollected Ġt rough Ġonline Ġsurveys , Ġsocial Ġmedia , Ġand Ġmon oring Ġbehaviour . Ġ ĠData Ġto Ġbe Ġcollected : Ġdemographics , Ġbehavioural Ġdata , Ġinterests Ġand Ġpreferences , Ġgoals Ġand Ġchallenges , Ġpsychographics Ġetc .","Data Ġcan Ġbe Ġsegmented Ġby Ġgroups Ġwith Ġsimilar Ġinterests , Ġattributes , Ġdemographics Ġsuch Ġas Ġage , Ġocc upation Ġetc . Ġ",Based Ġon Ġsegments . ĠB y Ġgathering Ġdata Ġand Ġupd ating Ġthe Ġdatabase Ġregularly .,Ġdid Ġnot Ġhave Ġtime Ġto Ġask Ġthis Ġfrom Ġthe Ġchatbot Ġbut Ġperhaps Ġby Ġchec king Ġthe Ġsources Ġthe Ġhave Ġbeen Ġused Ġfor Ġthe Ġpersona .,3,3,"Social media analytics,Surveys and interviews,Behavioral data from apps,All of the above",0,1,0,0,"C anva Ġcould Ġbe Ġused Ġfor Ġcollecting Ġdata Ġ ( Ġpeople Ġhave Ġcreated Ġtheir ĠC V s , Ġgre et ing Ġcar ds Ġetc . ) ĠP owerpoint , Ġperhaps Ġto Ġsee Ġhow Ġpeople Ġmake Ġtheir Ġpresent ations Ġand Ġuse Ġthat Ġinformation Ġfor Ġpersona Ġcreation .",Ġis ĠAPI ?,"Ġmore Ġdata , Ġthe Ġmore Ġsegments Ġand Ġmore Ġrealistic Ġpersonas .",3,3,4,5,2,2,3,4,5,6
2/13/25 0:19,2/13/25 0:35,193.166.113.16,975,R_2eIU07hZn7bydXj,63.1198,21.6798,0,0,11,51,2,1,1,20,"2,3,4","3,4","2,3,4","2,3",14,14,"1,2,3,4",1,2,2,1,.,..,.,"c Ġbe Ġtoo Ġgeneral , Ġnot Ġused Ġin Ġb iness Ġal th ough Ġcreated",0,2025-02-13 0:55:45,2025-02-13 1:29:05,193.166.113.16,1999,R_85e59HxYqMpu5Tb,63.1198,21.6798,0,0,"Ġtask Ġshould Ġactually Ġbe Ġdone Ġbefore Ġthe Ġcourse Ġstarts Ġin Ġorder Ġto Ġpl Ġthe Ġcourse Ġbet ter , Ġe . g . Ġin Ġthe Ġopen Ġuniversity . ĠI Ġwould Ġlike Ġto Ġknow Ġe . g . Ġtime Ġthey Ġhave Ġfor Ġstudies , Ġare Ġthey Ġworking Ġful lt m e / h al f / Ġat Ġall , Ġwhen Ġthey Ġcan Ġstudy Ġ ( e . g . Ġonly Ġat Ġthe Ġeven ings / e k ends Ġetc . ) , Ġwhat Ġare Ġtheir Ġgoals Ġ ( actual Ġlearning Ġor Ġjust Ġto Ġget Ġthe Ġcred ) , Ġwhat Ġis Ġtheir Ġbackground Ġ ( o cc upation , Ġwork Ġexperience Ġin Ġthe Ġtaught Ġsubj ect / el se ) , Ġdo Ġthey Ġprefer Ġonline Ġ ( yn cron uous Ġor Ġsyn cron ous ) Ġface - - f ace . ĠThere Ġcould Ġbe Ġa Ġsurvey Ġthey Ġanswer Ġbefore Ġthe Ġcourse Ġstarts . ĠĊ Ċ Ġthe Ġcase Ġof Ġa Ġcompany Ġand Ġits Ġcustom ers , Ġthe Ġdata Ġcollection Ġwould Ġbe Ġmore Ġex s ve Ġ","Ġthis Ġcase , Ġsim ple Ġquantitative Ġmetrics Ġand Ġqualitative Ġanalysis Ġof Ġopen Ġend ed Ġquestions Ġwould Ġbe Ġenough . ĠThen Ġsome Ġclustering Ġmaybe Ġto Ġform Ġsegments ĊĊ","Ġclustering Ġperhaps . ĠAlso Ġin Ġthe Ġcase Ġof Ġmarketing Ġcourses , Ġthe Ġmost Ġrelevant Ġquestions Ġwould Ġbe Ġthe Ġtime Ġthey Ġcan Ġspent Ġon Ġstudies Ġand Ġtheir Ġgoals , Ġbecause Ġit Ġwould Ġbe Ġbeneficial Ġto Ġmi x Ġdifferent Ġknowledge Ġlevel / ground Ġstudents . ĠBut Ġif Ġtheir Ġgo al Ġis Ġjust Ġto Ġp ass , Ġthey Ġcan Ġbe Ġa Ġb ur den Ġin Ġgroups Ġthat Ġhave Ġhigh Ġgoals","Ġcould Ġthen Ġd ivid e Ġthe Ġstudents Ġto Ġdifferent Ġgroups Ġbased Ġon Ġthese Ġpersonas . ĠI Ġcould Ġask Ġtheir Ġopin ions Ġif Ġthey Ġfeel Ġthat Ġthey Ġare Ġin Ġthe Ġright Ġgroup , Ġ ( c ause Ġthe Ġn um ber Ġis Ġnot Ġthat Ġmany ) , Ġalso Ġat Ġthe Ġend Ġof Ġthe Ġcourse , Ġthere Ġcould Ġbe Ġa Ġsurvey . Ċ , Ġin Ġa Ġcourse Ġset ting , ĠI ' m Ġnot Ġsure Ġhow Ġmuch ĠI Ġam Ġable Ġto Ġdifferent ate Ġthe Ġassignments Ġetc . Ġbut Ġfor Ġgroup Ġform ation Ġpurposes Ġthe Ġpersonas Ġcould Ġbe Ġuseful",6,6,All of the above,0,1,0,0,"Ġillustr te Ġthe Ġpersonas , Ġlike Ġposters Ġof Ġthem",w hat Ġis ĠAPI Ġ :),?,7,2,7,7,6,6,6,1,5,7
