2/13/25 0:11,2/13/25 0:21,193.166.113.5,551,R_2YEUpX50AEDp8hI,63.1198,21.6798,0,0,2,61,2,2,2,0,3,3,3,2,10,1,"1,2,3,4",1,2,2,1,don ' t Ġknow,don Ġ ' t Ġ Ä ł k,don Ġ ' t Ġ Ä ł k,?,0,2025-02-13 10:06:47,2025-02-13 10:28:39,193.166.113.5,1311,R_28J5LmGFsqExp3I,63.1198,21.6798,0,0,"P ers oon Ġlu om isen Ġpo h ja ksi Ġk n att aa ĠkerÃ¤tÃ¤ Ġhyvin Ġmon ip u ol isest Ġerila ista ĠsekÃ¤ Ġkvalitatiiv ista ĠettÃ¤ Ġkvantitatiiv ista Ġaineist o . Ġ Ha ast att el u j en Ġja Ġhavainno n Ġav ull ĠsekÃ¤ Ġerilais illa ĠkyselyillÃ¤ Ġvois ĠkerÃ¤tÃ¤ Ġesim . Ġse ur aa Ġtietoja : ĠhenkilÃ¶ n Ġdemogr af et Ġta ust , Ġval ok u ĠhenkilÃ¶stÃ¤ . ĠV ois ĠkerÃ¤tÃ¤ ĠsekÃ¤ Ġhavainno m ĠettÃ¤ ĠkyselyillÃ¤ Ġtietoja ĠsiitÃ¤ , Ġmiten ĠhenkilÃ¶ Ġto m ii Ġvast aa van lais essa Ġoppimist il ant e essa Ġesim . Ġmiten Ġp al j Ġky sy m y ksi Ã¤ Ġes tÃ¤Ã¤ , Ġk es k uste le e Ġto v ere d en Ġk ans sa , Ġte kee Ġm u ist p o ja Ġy ms . ĠK erÃ¤ isin ĠmyÃ¶s Ġtietoa Ġmm . Ġaiemm asta Ġk ou l ut uks est Ġja Ġaiemm ista Ġopin ista ĠsekÃ¤ Ġopint omen est y ks estÃ¤ Ġeri Ġtyyp iss Ã¤ Ġaine iss . ĠL isÃ¤ ksi ĠkerÃ¤ isin Ġtietoa Ġerilais ista Ġpersoon u ud en Ġp ir te istÃ¤ , Ġoppimist yy l istÃ¤ Ġ ( se kÃ¤ Ġmm . ĠsiitÃ¤ ĠminkÃ¤ lais et Ġoppim iss isÃ¤ ll Ã¶ t ĠhenkilÃ¶ Ġk o kee Ġva ike iksi Ġta Ġhelp o iksi , Ġopp ii ko Ġp ar ha iten Ġr y hm Ã¤ ss Ã¤ Ġva Ġyks ... ) , Ġopiskel ut ot t um uks ista , Ġopint ota vo itte ista , Ġku n n h m o sta , Ġ Ã¤ ly k k yy d estÃ¤ , Ġar vo ista ĠsekÃ¤ Ġas ent e ista Ġliittyen Ġopet eta vi Ġs isÃ¤ lt Ã¶ ihin ĠsekÃ¤ Ġliittyen Ġoppim iseen Ġja Ġom aan Ġo sa iseen .",E r ila isia Ġk luster oint m en et el m Ã¤ Ġv oid aan Ġk Ã¤ y t tÃ¤Ã¤ Ġsegment o m aan Ġkvantitatiiv isia Ġtietoja Ġja Ġto ki ĠmyÃ¶s Ġkvantitatiiv ise ksi Ġlu ok el t u ja Ġkvalitatiiv isia Ġtietoja . Ġ,"Segment t en Ġom ais u u ksi en Ġper uste ell Ġluodaan Ġkuvaus Ġsegment istÃ¤ , Ġj ota Ġsit ĠtÃ¤ y den n et Ã¤ Ã¤n Ġl ad ull isen Ġaineist Ġtar j o illa Ġyks ity ko h d illa Ġk ut en Ġkuv illa , Ġesimerk ki Ġmiel ip ite illÃ¤ Ġt ms . ĠN Ã¤ Ġluodaan Ġkuvaus Ġkuv itte ell isest ĠhenkilÃ¶stÃ¤ , Ġjok Ġhavain n oll ista Ġel Ã¤ v Ã¤ st Ġja Ġesimerk om ais est ĠminkÃ¤ l ain en Ġi hm inen Ġon Ġtyyp ill inen ĠtÃ¤ m Ã¤n Ġsegment Ġed usta ja . ĠOp et t ja Ġr Ã¤ Ã¤ tÃ¤ l Ã¶ Ġopet uks en Ġeri k se en Ġjok ais el le Ġpersoon al le .","K erÃ¤ tÃ¤ Ã¤n Ġtietoa Ġoppimistuloks ista Ġja Ġopiskelijoiden Ġkok emuks ista ; ĠsiitÃ¤ Ġmiten Ġhe Ġkok ivat Ġval un Ġoppim ista van . ĠOp iskel ij Ġvois ivat ĠmyÃ¶s Ġit se Ġar vi oid Ġku ink Ġhyvin Ġse Ġpersoon , Ġjo h Ġheid Ã¤n Ġk ats ot aan Ġku ul u van , Ġheid Ã¤ Ġom asta Ġmiel estÃ¤ Ã¤n Ġkuva Ġhe Ã¤ . ĠV er r ata Ġoppimistuloks ia Ġja Ġopiskelijoiden Ġoppim k ok emuks ia Ġk ah den Ġopiskelij ary hm Ã¤n Ġv Ã¤ l illÃ¤ Ġa ) Ġta van om ista Ġopetusta Ġsaaneet Ġv s . Ġ2 ) Ġpersoon o ihin Ġper ust u va Ġopetusta Ġsaaneet",3,3,"Social media analytics,Surveys and interviews,Behavioral data from apps,All of the above",1,1,0,0,Ġillustrating Ġthe Ġpersonas,?,?,6,6,6,6,2,6,6,2,4,5
2/13/25 0:09,2/13/25 0:21,193.166.125.254,720,R_80M4qTqlbBDJBt2,63.0945,21.631,0,0,26,46,1,2,1,10+,"1,2,3,4",5,4,2,11,11,4,1,2,2,1,Ġdata Ġvisual ation Ġand Ġanalysis,Ġ Ä ł te gr ation Ġ Ä ł p ur poses Ġ ?,accuracy Ġ Ä ł o f Ġ Ä ł persona Ġ Ä ł p ro f ile Ġ ?,te chn ical Ġskills Ġand Ġcap bil ities Ġlacking Ġfrom Ġmarketing Ġprof ess ion als Ġto Ġfully Ġintegr ate Ġthe Ġp ot ent ial Ġof Ġdata Ġdriven Ġpersonas . Ġ,0,2025-02-13 10:06:28,2025-02-13 10:17:29,193.166.125.254,660,R_8J4n2Y3AswIDDu5,63.0945,21.631,0,0,"Ġlim ited Ġtime Ġdiscussion Ġwith Ġthe Ġb ot Ġdid nt Ġallow Ġme Ġto Ġget Ġto Ġthis Ġtask Ġassignment . Ġthe Ġdiscussion Ġl ed Ġto Ġsome Ġdetail s Ġon Ġevaluation Ġmethods Ġbetween Ġexp er ts Ġand Ġstudents Ġand Ġwere Ġnot Ġfocus ed Ġon Ġthe Ġtasks . Ċ Ċ , Ġbased Ġon Ġprevious Ġknowledge Ġi Ġwould Ġdo Ġthis : Ġ Ċ L o ok Ġat ĠR ec ds : ĠC hec k Ġun Ġinfo Ġlike Ġage , Ġgrades , Ġand Ġwhat Ġother Ġclasses Ġpeople Ġhave Ġtaken . Ċ Ask ĠQu est ions Ġ : ĠUse Ġonline Ġsurvey Ġto Ġask Ġstudents Ġabout Ġtheir Ġgoals , Ġst ru g g les , Ġand Ġhow Ġthey Ġlike Ġto Ġlearn Ġmarketing . Ċ T alk Ġto ĠStudents : ĠC hat Ġwith Ġsome Ġstudents Ġto Ġreally Ġunderstand Ġwhat Ġmakes Ġthem Ġt ick , Ġwhat Ġthey Ġwant Ġfrom Ġthe Ġclass , Ġetc . Ċ - ĠG roup ĠD iscussions : ĠG et Ġs m Ġgroups Ġof Ġstudents Ġto Ġto Ġt alk Ġabout Ġtheir Ġexperiences Ġand Ġwhat Ġthey Ġexpect Ġfrom Ġthe Ġcourse Ġor Ġthe Ġdegree Ġin Ġgeneral . Ċ","Group ĠS m ilar ĠStudents : ĠUse Ġcomputer Ġtools Ġto Ġput Ġstudents Ġinto Ġgroups Ġbased Ġon Ġwhat Ġthey Ġhave Ġin Ġcommon . Ċ F ig ure Ġout Ġthe Ġmost Ġimportant Ġthings Ġthat Ġin f l u ence Ġhow Ġstudents Ġact Ġin Ġthe Ġclass . Ċ R e ad Ġthrough Ġwhat Ġstudents Ġs d Ġin Ġinterviews Ġand Ġfocus Ġgroups Ġand Ġfind Ġcommon Ġthemes . Ċ Group Ġstudents Ġbased Ġon Ġhow Ġin v olved Ġthey Ġare , Ġhow Ġthey Ġlearn , Ġand Ġwhat Ġjobs Ġthey Ġwant Ġin Ġthe Ġfuture Ċ","P ick ĠI m p ortant ĠTr aits : ĠC ho ose Ġ 5 - 7 Ġthings Ġthat Ġdescribe Ġeach Ġ "" fake Ġstudent , "" Ġlike Ġtheir Ġage , Ġgoals , Ġchallenges , Ġand Ġhow Ġthey Ġlike Ġto Ġlearn . Ċ M ake Ġup Ġa Ġstory Ġfor Ġeach Ġ "" fake Ġstudent , "" Ġgiving Ġthem Ġa Ġname , Ġa Ġbackground , Ġand Ġdescrib ing Ġhow Ġthey Ġusually Ġact . Ċ F ind Ġa Ġpicture Ġthat Ġf Ġeach Ġ "" fake Ġstudent "" Ġand Ġput Ġall Ġtheir Ġinfo Ġin Ġan Ġeas y - - read Ġform . Ċ Use Ġa ĠT em pl ate : ĠKeep Ġall Ġthe Ġ "" fake Ġstudent "" Ġprofiles Ġor g ized Ġand Ġcons ist ent . Ċ","Ask Ġnew Ġstudents Ġto Ġp ick Ġwhich Ġ "" fake Ġstudent "" Ġis Ġmost Ġlike Ġthem . ĠIf Ġmost Ġstudents Ġcan Ġfind Ġa Ġmat ch , Ġwe ' Ġon Ġthe Ġright Ġtrack . Ġthis Ġis Ġto Ġbe Ġdone Ġat Ġthe Ġbegin n ing Ġof Ġthe Ġacademic Ġyear Ġand Ġuseful Ġfor Ġall Ġcourses . Ċ - ĠC ate Ġclass Ġmaterials Ġthat Ġare Ġdesign ed Ġfor Ġeach Ġ "" fake Ġstudent "" Ġand Ġsee Ġif Ġstudents Ġare Ġmore Ġinterested Ġin Ġone Ġor Ġthe Ġother Ġactivity . Ġ Evalu ate Ġwhich Ġactivity Ġwas Ġbest . Ċ ĠA s k Ġother Ġteach ers Ġif Ġthe Ġ "" fake Ġstudents "" Ġseem Ġlike Ġreal Ġstudents Ġthey ' ve Ġtaught . Ċ Ġa Ġyearly Ġbas , ĠKeep Ġimproving Ġthe Ġ "" fake Ġstudents "" Ġas Ġwe Ġget Ġnew Ġinformation Ġand Ġfeedback . Ċ",3,3,All of the above,0,1,0,0,Ġpresent Ġresults Ġof Ġpersona Ġresearch .,inter op er ability Ġof Ġdata Ġac qu ition,"data Ġanalysis , .",5,5,5,4,2,3,3,4,5,6
2/13/25 0:09,2/13/25 0:21,193.166.113.9,703,R_8gDEnlON1dLYBUZ,63.1198,21.6798,0,0,14,29,2,4,2,0,"3,4","3,4","3,4","2,3",11,1,4,5,5,2,1,Ġdon ' t Ġknow .,Ġ Ä ł don Ġ ' t Ġ Ä ł k Ġ .,"Marketing Ġ , Ġ Ä ł ad ds Ġ , Ġ Ä ł c t ent Ġ Ä ł c Ġ Ä ł Ġ Ä ł cur ated Ġ Ä ł Ġ Ä ł ind ivid ual Ġ Ä ł n e ed s Ġ Ä ł based Ġ Ä ł Ġ Ä ł Ġ Ä ł data Ġ Ä ł der ived Ġ Ä ł f rom Ġ Ä ł c ons um ers Ġ .",User Ġri ghts .,0,2025-02-13 10:06:33,2025-02-13 10:29:36,193.166.113.9,1383,R_8H1x0o4PzcWGAzO,63.1198,21.6798,0,0,"ĠI ' d Ġstart Ġby Ġdist ribut ing Ġa Ġsurvey Ġamong Ġthe Ġstudents Ġand Ġcollecting Ġtheir Ġdemographic Ġinformation . ĠI Ġwould Ġalso Ġadd Ġsome Ġquestions Ġthat Ġwould Ġgive Ġme Ġan Ġover view Ġof Ġtheir Ġpsychological Ġfeatures Ġrelated Ġto Ġlearning Ġ ( e . g . Ġabout Ġtheir Ġmotivations Ġon Ġthe Ġto p ic , Ġwhy ? ) Ġand Ġalso Ġquestions Ġrelated Ġto Ġtheir Ġbehaviour Ġ ( e . g . Ġhow Ġdo Ġyou Ġlearn Ġthe Ġbest , Ġinteract ing , Ġwatching Ġa Ġv d eo , Ġreading ... )","Ġha ving Ġthe Ġdata , ĠI Ġwould Ġshare Ġthe Ġclass Ġin Ġdifferent Ġgroups Ġbased Ġon Ġvarious Ġsegments ĠI Ġhave Ġidentified Ġfrom Ġthe Ġdata . ĠThese Ġsegments Ġwould Ġbe Ġcreated Ġaccording Ġto Ġthe Ġdifferent Ġattributes Ġrelated Ġto Ġlearning Ġidentified Ġfrom Ġthe Ġdata . ĠThen ĠI Ġwould Ġapply Ġthe Ġlearning Ġmethods Ġto Ġme et Ġthe Ġneeds Ġof Ġeach Ġsegment Ġ ( e . g . Ġa Ġgroup Ġthat Ġpre f ers Ġlearning Ġby Ġreading Ġwill Ġbe Ġgiven Ġar t ic les Ġto Ġread Ġby Ġthemselves Ġand Ġperhaps Ġmake Ġa Ġsumm ary ... )","Ha ving Ġthe Ġattributes Ġof Ġeach Ġsegments , ĠI Ġcould Ġtr y Ġto Ġconden se Ġthem Ġin Ġsome Ġtyp e Ġof Ġpersonas Ġthat Ġcan Ġbe Ġalso Ġillustr ated Ġvisually . ĠPerhaps Ġthese Ġpersonas Ġcould Ġthen Ġhelp Ġme Ġto Ġunderstand Ġthe Ġdifferent Ġtypes Ġof Ġlearners Ġon Ġmy Ġclass Ġand Ġalso Ġdesign ing Ġmy Ġclasses Ġand Ġmaterials Ġaccording Ġto Ġtheir Ġneeds .","Ġis Ġa Ġgood Ġquestion , Ġbecause Ġthe Ġl ter Ġstage Ġwould Ġcontain Ġmy Ġsubj ective Ġv ew Ġon Ġhow Ġthe Ġpersona Ġwould Ġlo ok Ġlike Ġat Ġthe Ġend . ĠIt Ġfor Ġsure Ġwill Ġm iss Ġsome Ġattributes Ġof Ġsome Ġof Ġthe Ġindividual Ġlearners ĠI ' ve Ġput Ġu nd er Ġthe Ġs ame Ġ "" persona "" . ĠHowever , Ġby Ġcollecting Ġcontinuous Ġfeedback Ġfrom Ġthe Ġstudents Ġ ( e . g . Ġshort Ġsurvey Ġa fter Ġeach Ġclass ? ) Ġwould Ġallow Ġme Ġto Ġmake Ġchan ges Ġon Ġthe Ġpersonas Ġover Ġtime . ĠI Ġguess Ġthis Ġis Ġwhat Ġthe Ġ "" d ynamic Ġpersonas "" Ġmean .",4,3,All of the above,0,2,0,0,B oth Ġmay Ġhelp Ġwith Ġillustrating Ġthe Ġpersona Ġwith Ġvarious Ġvisual Ġelements Ġand Ġtools .,Ġstill Ġdon ' t Ġknow Ġwhat ĠAPIs Ġis .,Ġtailor Ġmore Ġindividual ized Ġexperiences Ġfor Ġthe Ġusers .,5,2,4,3,2,2,6,5,5,5
2/13/25 0:10,2/13/25 0:21,193.166.113.12,689,R_2DqeNk7VcxzOI2g,63.1198,21.6798,0,0,5,47,2,2,1,around 20 yrs,"1,2,3,4",4,"3,4","2,3",12,12,4,1,2,2,1,Ġdata Ġsources ?,?,?,Ġare Ġnot Ġne cess ar ily Ġcon n ect ed Ġto Ġreal - life Ġconsumer Ġactions,0,2025-02-13 0:57:03,2025-02-13 1:18:28,193.166.113.12,1285,R_8IaAI1lS5Cv8UIF,63.1198,21.6798,0,0,"Ġdata Ġcollection Ġshould Ġbe Ġas Ġrich Ġas Ġpossible , Ġcontain ing Ġinformation Ġon Ġtheir Ġbasic Ġinfo Ġsuch Ġas Ġdemographics Ġand Ġgeographic , Ġbut Ġalso Ġabout Ġtheir Ġbehaviors Ġand Ġpsychograp ics . ĠS ources Ġfor Ġsuch Ġdata Ġcould Ġbe Ġsurveys , Ġobs er ving Ġstudents Ġin Ġthe Ġclass Ġroom , Ġand Ġcarry ing Ġout Ġinterviews , Ġor Ġeven Ġsocial Ġmedia Ġbehaviors . Ġ",Ġdata Ġanalysis Ġshould Ġbe Ġbased Ġon Ġm ap p ing Ġout Ġthe Ġpatterns Ġin Ġdata . ĠFor Ġquantitative Ġdata Ġbasic Ġmethods Ġused Ġfor Ġsegmentation Ġsuch Ġas Ġcluster Ġanalysis Ġrelying Ġon ĠK - means Ġmethod Ġcan Ġbe Ġapplied . ĠFor Ġqualitative Ġdata Ġtypical Ġmethods Ġfor Ġlarge Ġqualitative Ġdata Ġsuch Ġas ĠNLP Ġcan Ġbe Ġapplied . Ġ,"Ġcreated Ġpersonas Ġwould Ġbe Ġdescrib ed Ġas Ġrich ly Ġas Ġpossible , Ġcons isting Ġon Ġinfo Ġsuch Ġas Ġfict ious Ġname , Ġtr aits , Ġbackground Ġst ories , Ġwhat Ġkind Ġof Ġgoals Ġand Ġchallenges Ġthey Ġpossi bly Ġface Ġand Ġhow Ġthey Ġmay Ġbe Ġs olved . ĠThe Ġpersonas Ġshould Ġbe Ġvisualized Ġfor Ġexample Ġusing Ġcanva Ġor Ġp pt . Ġ","Ġneeds Ġto Ġbe Ġunders od Ġthat Ġpersonas Ġare Ġnot Ġstatic Ġbut Ġchange Ġin Ġtime , Ġfor Ġexample Ġeach Ġyear Ġthe Ġgroup Ġof Ġstudents Ġare Ġa Ġb Ġdifferent , Ġso Ġupd ates Ġare Ġneeded Ġregularly . ĠAlso , Ġit Ġis Ġimportant Ġthat Ġpersonas Ġare Ġnot Ġonly Ġrelying Ġon Ġquantitative Ġdata , Ġbut Ġto Ġensure Ġdeep Ġunderstanding Ġqualitative Ġdata Ġis Ġneeded Ġas Ġwell , Ġfor Ġinst ance Ġinterview ing Ġstudents . ĠB oth Ġinternal Ġ ( e . g . Ġuser Ġtesting ) Ġand Ġexternal Ġvalidation Ġcan Ġbe Ġused Ġfor Ġensuring Ġtr ustworth iness Ġof Ġdata . ĠThe Ġaspects Ġrelated Ġto Ġethics Ġneed Ġto Ġbe Ġtaken Ġcare Ġof , Ġfor Ġexample Ġdata Ġprot ect ion , Ġprivacy Ġcon c er n s Ġand Ġan y m ity . Ġ",4,5,All of the above,0,1,0,0,Cre ating Ġvisual iz ations Ġof Ġthe Ġcreated Ġpersonas,Ġensuring Ġgood Ġquality Ġdata Ġ ( e . g . Ġrem o ving Ġinconsistencies Ġor Ġd u plic ates ),Ġdata Ġanalysis Ġ,5,2,6,5,3,2,6,3,2,6
2/13/25 0:09,2/13/25 0:22,193.166.113.17,792,R_8psMyJI5hbY6Skf,63.1198,21.6798,0,0,6,45,2,1,1,18,"1,3,4",4,3,2,13,12,4,1,2,2,1,Ġdon ' t Ġknow,Ġ Ä ł don Ġ ' t Ġ Ä ł k,"Ġ Ä ł don Ġ ' t Ġ Ä ł k Ġ , Ġ Ä ł m ay Ġ Ä ł Ġ Ä ł m ake Ġ Ä ł Ġ Ä ł d e vel op ment Ġ Ä ł p ro cess Ġ Ä ł m o Ġ Ä ł e ff ective Ġ Ä ł Ġ Ä ł ter ms Ġ Ä ł o f Ġ Ä ł t m e Ġ Ä ł Ġ Ä ł m ey Ġ Ä ł Ġ Ä ł Ġ Ä ł Ġ Ä ł able Ġ Ä ł Ġ Ä ł use Ġ Ä ł m o Ġ Ä ł data",Data Ġprivacy Ġissues ; Ġlack Ġof Ġknowledge Ġof Ġhow Ġto Ġinterpret Ġthe Ġdata Ġavailable,0,2025-02-13 10:06:53,2025-02-13 10:28:13,193.166.113.17,1280,R_2yEUbMrYAXWOCKB,63.1198,21.6798,0,0,"Data - driven Ġpersonas Ġfrom Ġmarketing Ġstudents Ġcan Ġbe Ġcreated Ġby Ġcollecting Ġmany Ġtypes Ġof Ġdata . ĠYou Ġcan Ġcollect Ġqualitative Ġdata Ġ ( inter view s Ġand Ġfocus Ġgroups ) Ġand Ġfind Ġout Ġhow Ġstudents Ġlearn , Ġwhat Ġmotivations Ġthey Ġhave Ġin Ġlearning , Ġand Ġwhat Ġchallenges Ġthey Ġface . ĠYou Ġshould Ġalso Ġcollect Ġquantitative Ġdata Ġto Ġcomple te Ġthe Ġunderstanding . ĠThese Ġcan Ġinclude Ġwe b - alytics , Ġsocial Ġmedia Ġinteractions Ġ ( e . g . Ġwatching Ġyour Ġteaching Ġv ide os Ġfrom Ġy u ) , Ġtime Ġspent Ġwith Ġchatbot s , Ġsurvey Ġdata Ġand ĠLearning ĠM agement ĠS ystem Ġdata Ġ ( Ġstudents Ġperform Ġin Ġtheir Ġstudies ) . ĠThe Ġide al Ġsample Ġs ize Ġis Ġbetween Ġ30 Ġand Ġ30 0 . ĠYou Ġneed Ġto Ġbe Ġcare ful Ġwith Ġresearch Ġethics Ġwhen Ġcollecting Ġthe Ġdata .","Ġcollecting Ġthe Ġdata , Ġyou Ġneed Ġto Ġanalyse Ġit . ĠF irst , Ġyou Ġneed Ġto Ġdefine Ġthe Ġvariables Ġyou Ġwill Ġuse Ġwhen Ġsegmenting Ġthe Ġstudents Ġinto Ġgroups . ĠV ar iables Ġinclude Ġbehavioral Ġvariables Ġand Ġdemographics , Ġalso Ġattitudes Ġcould Ġbe Ġinclud ed . ĠThen Ġyou Ġwill Ġuse Ġstatistical Ġtechn olog ies Ġto Ġcluster Ġthe Ġdata . ĠThis Ġprodu ces Ġtypical ly Ġ3 - 7 Ġsegments . ĠC luster Ġcan Ġbe Ġcombined Ġduring Ġthe Ġprocess . ĠFinally , Ġyou Ġneed Ġto Ġiter ate Ġand Ġrefine Ġthe Ġanalysis Ġu nt il Ġyou Ġget Ġsegments Ġthat Ġare Ġcredible . Ġ","Personas Ġare Ġbuil t Ġfrom Ġthe Ġsegmentation Ġdata . ĠA gain , Ġyou Ġcan Ġstart Ġby Ġidentify ing Ġthe Ġkey Ġattributes Ġ ( demographics , Ġbehaviors , Ġattitudes ) . ĠThen Ġyou Ġcan Ġcreate Ġprofiles Ġthat Ġhave Ġnames , Ġdemographics , Ġp hy s ical Ġappear ance , Ġindividual Ġgoals , Ġneeds Ġand Ġlife Ġpurposes . ĠR em ember Ġto Ġinclude Ġemot ional Ġvariables . ĠNext , Ġyou Ġcan Ġmake Ġthe Ġvisual Ġrepresentations Ġof Ġthe Ġprofiles . ĠA fter Ġthe Ġvisual ization , Ġrefine Ġthe Ġresults . ĠFinally , Ġdocument Ġand Ġshare Ġthe Ġpersonas . Ġ","Evalu ation Ġof Ġthe Ġpersonas Ġcreated Ġis Ġimportant . ĠThere Ġare Ġse ver al Ġevaluation Ġcriteria Ġthat Ġshould Ġbe Ġused . ĠThese Ġinclude Ġthe Ġreliability Ġand Ġvalidity Ġcriteria , Ġsuch Ġas Ġcredibility , Ġcons istenc y , Ġcompleteness Ġand Ġusefulness . ĠIt Ġis Ġalso Ġimportant Ġto Ġcollect Ġfeedback Ġfrom Ġthe Ġparticipants Ġthemselves Ġand Ġfrom Ġthe Ġusers Ġof Ġthe Ġpersonas .",5,6,All of the above,0,1,0,0,Ġvisualize Ġthe Ġcreated Ġpersona Ġprofiles . Ġ,Ġdefine Ġthe Ġkey Ġind ic s Ġand Ġto Ġanalyse Ġthe Ġdata .,Ġcollect Ġbehavioral Ġdata Ġfrom Ġthe Ġusers . Ġ,5,6,6,6,6,6,5,6,6,6
2/13/25 0:09,2/13/25 0:23,193.166.113.22,834,R_8TLYE9YUX3OOvcZ,63.1198,21.6798,0,0,21,35,2,1,2,0,"1,2,3,4","3,4,5",4,"2,4",12,10,4,1,2,2,1,' m Ġnot Ġfamiliar Ġwith Ġthese Ġtools,Ġ ' m Ġ Ä ł Ġ Ä ł f iliar Ġ Ä ł w ith Ġ Ä ł PI s,Maybe Ġ Ä ł Ġ Ä ł pre dict Ġ Ä ł f ut ure Ġ Ä ł ha vi s Ġ ?,"S m plified Ġex amp les Ġof Ġcomplex Ġindividual s ? ĠC Ġwe Ġal w ay s Ġunderstand Ġthe Ġ "" wh y "" Ġfrom Ġthe Ġdata ?",0,2025-02-13 0:57:36,2025-02-13 1:23:54,193.166.113.22,1578,R_8r3crXbyFYzJCLk,63.1198,21.6798,0,0,"Data Ġcould Ġbe Ġcollected Ġwith Ġstudent Ġsurvey Ġincl . Ġdemographics , Ġworking Ġinformation , Ġexpect ations , Ġgoals Ġetc . ĠNext , Ġlect ure Ġnot es Ġ ( Ġsome Ġsystem ) Ġ- Ġwho Ġparticipated Ġto Ġthe Ġcourse , Ġobserv ation Ġduring Ġlectures , Ġgroup Ġwor ks Ġetc , Ġinterviews Ġduring Ġlectures Ġetc . ĠAlso , Ġdata Ġfrom Ġcourse ĠMoodle Ġp age Ġ ( Ġstudents Ġuse Ġit , Ġhow Ġoften , Ġhow Ġl ong , Ġwhich Ġpages .. . ) . ĠC ourse / sign ment Ġgrades Ġfrom ĠP e pp Ġor ĠMoodle . ĠFinally , Ġstudent Ġfeedback Ġsurvey . Ġ",Ġidentify Ġcommon Ġthemes Ġfrom Ġthe Ġdata Ġand Ġcluster Ġanalysis .,"Cre ate Ġprofiles Ġfrom Ġthese Ġcommon Ġthemes , Ġname Ġthem , Ġadd Ġa Ġ "" p hoto "" , Ġw r ite Ġtheir Ġstory Ġ- Ġwho Ġthey Ġare , Ġwhat Ġtheir Ġha b , Ġinterests Ġand Ġmotivations Ġare , Ġwhat Ġare Ġtheir Ġgoals Ġwith Ġthe Ġcourse Ġand Ġdegree , Ġhow Ġthey Ġare Ġgoing Ġto Ġwork Ġto Ġre ach Ġthe Ġgoals , Ġare Ġthey Ġgoing Ġto Ġcont act Ġthe Ġteacher Ġetc . , Ġtheir Ġpreferences Ġin Ġdifferent Ġteaching Ġmethods Ġand Ġrem ote / Ġperson Ġworking , Ġte Ġworking Ġskills . ĠThese Ġpersonas Ġcould Ġbe Ġvisualized Ġwith Ġcanva .",Collecting Ġof Ġnew Ġdata Ġand Ġfor Ġexample Ġyearly Ġevaluation Ġand Ġaud ing Ġof Ġthe Ġusefulness Ġand Ġif Ġthey Ġare Ġup Ġto Ġd ate Ġwith Ġthe Ġcur r ent Ġtrends . ĠC han ging Ġthe Ġpersonas Ġwhen Ġnot Ġany m o Ġvalid .,4,2,"Social media analytics,Surveys and interviews,Behavioral data from apps,All of the above",0,1,0,0,Ġvisualize Ġand Ġpresent Ġthe Ġpersona Ġprofile,D ' t Ġknow Ġstill,Ġupdate Ġand Ġpredict Ġpersonas,5,3,6,6,5,5,5,1,2,4
2/13/25 0:09,2/13/25 0:23,193.166.113.3,866,R_86geScPtfqLtI7D,63.1198,21.6798,0,0,17,32,2,2,1,1,"1,2,3,4","1,2,3,4",3,"2,3",13,10,4,3,2,2,1,Ġwould Ġassume Ġthat Ġthey Ġwork Ġas Ġa Ġc od ing Ġplatforms .,Ġ Ä ł ha ve Ġ Ä ł Ġ Ä ł ide Ġ Ä ł bout Ġ Ä ł t hat Ġ . Ġ Ä ł,Ġ Ä ł c Ġ Ä ł Ġ Ä ł ed Ġ Ä ł Ġ Ä ł le arn Ġ Ä ł bout Ġ Ä ł Ġ Ä ł er Ġ Ä ł Ġ Ä ł d e vel op Ġ Ä ł m o Ġ Ä ł ad van ced Ġ Ä ł p ersonas Ġ Ä ł c ust om ized Ġ Ä ł Ġ Ä ł Ġ Ä ł pl atform Ġ Ä ł er Ġ Ä ł Ġ Ä ł ex ample Ġ . Ġ Ä ł,"Ġwhat Ġc ir cum st ces Ġare Ġthem Ġreally Ġneeded , Ġand Ġhow Ġmuch Ġen erg y Ġuse Ġand Ġother Ġres ources Ġthey Ġdem Ġfrom Ġs ust ain ability Ġpers p ective . Ġ",0,2025-02-13 0:55:53,2025-02-13 1:11:36,193.166.113.3,942,R_2oF0etoyFkyv6pt,63.1198,21.6798,0,0,"Data Ġshould Ġbe Ġboth Ġquantitative Ġand Ġqualitative Ġin Ġorder Ġto Ġg ain Ġin Ġde p th Ġunderstanding . ĠIt Ġcould Ġbe Ġcollected Ġfrom Ġsocial Ġmedia Ġplatforms Ġand Ġsurveys . ĠGoogle Ġanalytics Ġis Ġone Ġtool Ġto Ġuse Ġhere . ĠInformation Ġcollected : age , Ġgender , Ġjo b , Ġpl ace Ġof Ġres d ence , Ġand Ġbehavioral Ġinsights . Ġ","Ġwas Ġnot Ġclear Ġto Ġme . ĠS ome Ġkind Ġof Ġsegmenting Ġshould Ġbe Ġused , Ġcombining Ġinternal Ġand Ġexternal Ġvalidation . Ġ","Ġpersona Ġcan Ġbe Ġnam ed Ġas Ġ "" S ar ah "" Ġfor Ġexample Ġand Ġthe Ġinformation Ġcollected Ġcan Ġbe Ġcombined Ġand Ġatt ac d Ġto Ġh er . ĠThe Ġinfo Ġcan Ġbe Ġp ort r ay ed Ġas Ġa Ġpos ter Ġwhere Ġthere Ġis Ġa Ġpicture Ġalso Ġabout Ġthe Ġpersona . Ġ","Ġdata Ġsource Ġshould Ġbe Ġevalu ated , Ġthe Ġdata Ġshould Ġbe Ġreg ur arly Ġaud ited Ġand Ġupdated Ġif Ġneeded . ĠQuantitative Ġdata Ġshould Ġnot Ġbe Ġthe Ġonly Ġdata Ġsource . Ġ",5,2,"Social media analytics,Surveys and interviews,Behavioral data from apps,All of the above",0,3,0,0,Ġvisualize Ġthe Ġpersona .,Ġdon ' t Ġknow .,"Machine Ġlearning Ġalgorithms Ġcan Ġbe Ġused Ġto Ġdevelop Ġthe Ġpersona Ġfurther , Ġas Ġthe Ġalgorithms Ġlearn Ġmore Ġabout Ġthe Ġonline Ġplatform Ġuser .",4,2,5,4,2,5,6,3,2,6
2/13/25 0:09,2/13/25 0:24,193.166.113.27,878,R_22ss9u3WMKpIit2,63.1198,21.6798,0,0,24,57,1,1,2,over 20 years,"1,3","3,4",3,"2,3,4",10,10,"1,3",1,2,2,1,Ġdo Ġnot Ġknow,Ġ Ä ł d o Ġ Ä ł Ġ Ä ł k,Ġ Ä ł t il oring Ġ Ä ł Ġ Ä ł c ust om izing Ġ Ä ł,"P r ivacy Ġissues Ġand Ġ ( ) accuracy Ġwith Ġwhich Ġthey Ġdescribe Ġ "" al "" Ġpeople",0,2025-02-13 10:07:42,2025-02-13 10:31:26,193.166.113.27,1424,R_2Y4m8OkEefuHk0m,63.1198,21.6798,0,0,- ĠF ocus Ġgroup Ġdiscussions Ġand Ġinterviews Ġwith Ġstudents Ċ - ĠS cr ap ing Ġfrom Ġsocial Ġmedia Ġplatforms Ġthey Ġuse Ċ - ĠTr ack ing Ġtheir Ġuse Ġof Ġl b r ary Ġsources,"- ĠA Ġthem ic Ġanalysis Ġcan Ġbe Ġcondu cted Ġto Ġthe Ġqualitative Ġdata Ċ - ĠD emographic Ġdata Ġcould Ġbe Ġl inked Ġto Ġthe Ġem erg ence Ġof Ġthe Ġthemes Ċ - Ġ Ex pl ory Ġand Ġdescriptive Ġanalyses Ġcan Ġbe Ġemploy ed Ġto Ġbuild Ġpersonas Ċ - ĠUse Ġof Ġany Ġanalytical Ġmethods , Ġso Ġcalled Ġt ri g ulation Ċ Ġ","- ĠPersonas Ġcould Ġbe Ġhuman ized Ġby Ġl king Ġthem Ġwith Ġinsights Ġfrom Ġreal Ġbehavioral Ġdata Ċ - ĠPersonas Ġshould Ġbe Ġupdated Ġcontinuous ly Ġby Ġnew Ġdata Ġinput s Ċ - ĠThe Ġvalidity Ġof Ġthe Ġcreated Ġpersonas Ġshould Ġbe Ġcrit ically Ġchecked Ċ - ĠTo Ġinc ase Ġthe Ġpers u iveness Ġof Ġpersonas , Ġcre ivity Ġcan Ġalso Ġbe Ġb rough t Ġinto Ġplay ĠĊ",- ĠPersonas Ġcan Ġbe Ġp il ot ed Ġand Ġfeedback Ġcollected Ċ - ĠPersonas Ġshould Ġbe Ġregularly Ġassess ed Ġfor Ġthe Ġcompleteness Ġand Ġaccuracy Ċ - ĠP er form ance Ġand Ġquality Ġmeas ure ments Ġshould Ġbe Ġtaken Ġwith Ġvalidated Ġinst r um ents Ċ - ĠLearning Ġoutcomes Ġshould Ġbe Ġcollected Ġand Ġanalyzed Ġand Ġcorrect ve Ġactions Ġtaken Ġif Ġneeded,2,2,"Social media analytics,Surveys and interviews,Behavioral data from apps",0,1,0,0,Ġdo Ġnot Ġknow,Ġdo Ġnot Ġknow,Ġtailoring Ġand Ġcustomizing Ġs erv ic es Ġand Ġm ess ages,2,5,5,4,1,4,5,4,2,6
2/13/25 0:10,2/13/25 0:26,193.166.109.31,958,R_2efyuebZUs1NBPr,63.1092,21.5936,0,0,16,34,2,2,2,0,"1,2,3","2,4",2,2,12,10,4,1,2,2,1,Ġdon ' t Ġknow,Ġ Ä ł don Ġ ' t Ġ Ä ł k Ġ Ä ł w hat Ġ Ä ł Ġ Ä ł PI,Ġ Ä ł utom atically Ġ Ä ł d e vel op Ġ Ä ł p ersonas Ġ Ä ł based Ġ Ä ł Ġ Ä ł data Ġ Ä ł Ġ Ä ł Ġ Ä ł m od ify Ġ Ä ł m Ġ Ä ł Ġ Ä ł n ew Ġ Ä ł data Ġ Ä ł comes Ġ Ä ł va ila ble Ġ .,"Ġdon ' t Ġknow Ġwhat Ġkind Ġof Ġphenomenon Ġis Ġpersona Ġphenomenon . ĠI Ġth ink Ġit Ġsounds Ġs p ici ous , Ġnon - tr ustworth y Ġand Ġyou Ġquestion Ġthe Ġmotivations Ġbe h ind Ġit . ĠIt Ġmay Ġalso Ġsim pl ify Ġcomplex Ġperson s Ġinto Ġsim plified Ġpersonas Ġand Ġr ise Ġquestions Ġhow Ġthe Ġpersonas Ġrepresent Ġand Ġcreate Ġreal ity . ĠI Ġprefer Ġhuman Ġinteraction . Ġ",0,2025-02-13 10:07:09,2025-02-13 10:24:05,193.166.109.31,1015,R_2v0NZEz6BfYN0xy,63.1092,21.5936,0,0,"Ġcan Ġcollect Ġdata Ġthrough Ġbehavioural Ġdata Ġonline Ġand Ġin Ġsocial Ġmedia Ġand Ġit Ġcan Ġbe Ġcomple ment ed Ġwith Ġqualitative Ġdata Ġthrough Ġsurveys Ġand Ġinterviews . ĠK ing Ġthe Ġdemographics , Ġinterests , Ġgoals Ġand Ġfrustrations Ġis Ġimportant Ġin Ġpersona Ġdevelopment .","Ġdata Ġcan Ġbe Ġsegmented Ġbased Ġon Ġdemographics Ġsuch Ġas Ġage , Ġgender , Ġeducational Ġlevel , Ġand Ġinterests , Ġgoals Ġand Ġfrustrations . ĠThe Ġpersona Ġshould Ġalso Ġbe Ġupdated Ġwith Ġnew Ġinformation Ġevery Ġn ow Ġand Ġthen .","P ersona Ġprofiles Ġand Ġinclude Ġ1 - 2 Ġp . Ġdescription Ġof Ġthe Ġperson Ġwith Ġa Ġphoto Ġand Ġname . ĠThe Ġdescription Ġshould Ġbe Ġrealistic , Ġse Ġand Ġrelatable Ġto Ġthe Ġuser Ġand Ġit Ġshould Ġcover Ġthe Ġpersona Ġinterests , Ġp ast , Ġand Ġfuture Ġgoals .","Ġcould Ġcondu ct Ġuser Ġstudies Ġwith Ġthe Ġpersonas Ġto Ġsee , Ġhow Ġaccurate , Ġrelatable , Ġand Ġcredible Ġthey Ġare Ġand Ġhow Ġstudents Ġperce ve Ġthem . ĠIn Ġaddition , Ġone Ġcould Ġtest Ġthe Ġlearning Ġoutcomes Ġwith Ġand Ġwith Ġdifferent Ġpersonas Ġto Ġsee , Ġwhether Ġthey Ġare Ġactually Ġuseful Ġin Ġthe Ġteaching Ġof Ġa Ġmarketing Ġcourse .",4,3,All of the above,0,1,0,0,"Ġcreate Ġthe Ġdescription Ġof Ġthe Ġpersona Ġwith Ġa Ġname , Ġphoto , Ġand Ġin t ro du ction Ġto Ġthe Ġpersona Ġh ist ory , Ġinterests , Ġand Ġfuture Ġgoals .",Ġdon ' t Ġknow Ġwhat ĠAPI Ġis .,Ġcan Ġautom ate Ġthe Ġdevelopment Ġprocess Ġcreating Ġpersonas Ġbased Ġon Ġavailable Ġdata .,5,6,5,5,5,5,5,3,6,3
