start_date_pre,end_date_pre,ip_address_pre,duration_sec_pre,response_id_pre,LocationLatitude_pre,LocationLongitude_pre,DistributionChannel_pre,UserLanguage_pre,participant_id,age_pre,gender_pre,occupation_pre,teaching_marketing_pre,teaching_experience_pre,learning_style_pre,learning_format_pre,interaction_preference_pre,trusted_learning_method_pre,ai_familiarity_pre,ddp_familiarity_pre,data_sources_pre,persona_definition_pre,interactive_persona_pre,data_driven_persona_pre,dynamic_persona_pre,tableau_usage_pre,api_usage_pre,ml_application_pre,persona_explanation_pre,confirmation_pre,start_date_post,end_date_post,ip_address_post,duration_sec_post,response_id_post,LocationLatitude_post,LocationLongitude_post,DistributionChannel_post,UserLanguage_post,data_collection_explanation_post,data_analysis_explanation_post,persona_building_explanation_post,evaluation_explanation_post,ai_familiarity_post,ddp_familiarity_post,data_sources_post,persona_definition_post,interactive_persona_post,data_driven_persona_post,dynamic_persona_post,tools_usage_post,api_usage_post,ml_application_post,engagement_experience_post,interaction_quality_post,communication_clarity_post,trustworthiness_post,emotional_response_post,naturalness_post,effectiveness_post,comfort_level_post,personalization_post,mental_effort_post
2/13/25 0:10,2/13/25 0:16,193.166.113.18,372,R_8GBoA0i1k6yogS1,63.1198,21.6798,0,0,1,60,1,1,1,20,3,"3,4","3,4","2,3,4",12,10,4,1,2,2,1,Ġdo Ġnot Ġknow,Ġ Ä ł d o Ġ Ä ł Ġ Ä ł k,Ġ Ä ł d o Ġ Ä ł Ġ Ä ł k,Ġdo Ġnot Ġknow,0,2025-02-13 0:56:11,2025-02-13 1:18:59,193.166.113.18,1368,R_8QL21bpDcdbdtJ4,63.1198,21.6798,0,0,"Ġcollect Ġstud en s ' Ġdemographic Ġdata , Ġdata Ġof Ġtheir Ġstudy Ġpro gre ss ion , Ġi . e . , Ġwhat Ġcourses Ġthey Ġhave Ġdone , Ġwhat Ġhave Ġbeen Ġtheir Ġgrades . Ġthese Ġinformation Ġcan Ġbe Ġcollected Ġfrom Ġstudy Ġreg ter . ĠI Ġcould Ġalso Ġask Ġtheir Ġcon sent Ġprovide Ġto Ġgive Ġfeedback Ġhow Ġthey Ġhave Ġperce ived Ġsome Ġof Ġthe Ġcourse Ġ ( e . g . , Ġcourse Ġfeedback ) . ĠIf Ġthey Ġallow Ġto Ġgive , ĠI Ġwould Ġlike Ġto Ġask Ġabout Ġtheir Ġonline Ġbehaviour . ĠS u fficient Ġdata Ġmaybe Ġfrom Ġall Ġparticipants Ġor Ġmost Ġof Ġthem .","Ġthe Ġdata Ġmust Ġbe Ġcle ed . Ġto Ġa ch e ve Ġhigh Ġquality Ġof Ġdata . ĠAlso Ġthe Ġprivacy Ġissues Ġshould Ġbe Ġconsidered . ĠThe Ġdata Ġneeds Ġto Ġcluster ed , Ġcombined Ġand Ġvalidated . Ġ","Ġclustering Ġand Ġcombining , Ġthe Ġpersonas Ġmust Ġbe Ġsummar ized Ġin Ġorder Ġto Ġmake Ġprofiles . ĠThe Ġidea Ġis Ġgroup Ġsimilar Ġstudents . ĠThe Ġprof iles Ġare Ġdescriptions Ġof Ġthe Ġpersonas Ġin Ġon Ġvisualized Ġand Ġfor ms . ĠAlso ĠAI Ġcan Ġbe Ġused Ġto Ġcreate Ġdynamic Ġpersonas , Ġthat Ġlearn Ġfrom Ġthe Ġnew Ġdata , Ġand Ġevolve Ġas Ġthe Ġstudents Ġevolve .","Ġevaluation Ġcan Ġbe Ġdone Ġe . g . , Ġwith Ġtr ad ition al ĠA / B Ġtesting Ġmethod . ĠThe Ġpersonas Ġmust Ġalso Ġbe Ġvalidated Ġf qu ent ly .",4,4,All of the above,0,1,0,0,Ġcommunicate Ġthe Ġpersonas Ġto Ġthe Ġusers . ĠTo Ġvisualize Ġthe Ġpersonas Ġto Ġthe Ġusers .,B ec ause Ġrelevant Ġdata Ġcan Ġbe Ġobtained Ġfrom Ġthem .,"Ġcan Ġbe Ġused Ġe . g . , Ġin Ġclustering Ġand Ġcombining Ġthe Ġdata .",5,1,7,2,2,1,6,6,1,4
2/13/25 0:09,2/13/25 0:16,193.166.113.32,409,R_8QG2UV0Zv0fKVB5,63.1198,21.6798,0,0,23,41,1,2,2,0,"1,3,4","2,4","3,4","2,3,4",10,1,4,1,2,2,1,"Ġdo Ġnot Ġknow Ġthese Ġtools , Ġso ĠI Ġcannot Ġanswer . Ġ",Ġ Ä ł ha ve Ġ Ä ł Ġ Ä ł c l ue Ġ . Ġ Ä ł,Ġ Ä ł ha ve Ġ Ä ł Ġ Ä ł c l ue Ġ .,Ġhave Ġno Ġclue .,0,2025-02-13 0:56:02,2025-02-13 1:13:21,193.166.113.32,1039,R_8QrAaCxxXwbpxvL,63.1198,21.6798,0,0,"User Ġanalytics : ĠGoogle Ġanalytics , ĠCRM , ĠAPIs Ġetc . Ġ","Segment ation Ġcan Ġbe Ġperform ed Ġso Ġthat Ġeach Ġpersona Ġreflects Ġa Ġcertain Ġbehavioural Ġpattern Ġand / Ġis Ġbased Ġon Ġcommon Ġbackground / psy ch ological , Ġdemogr r ap hics , Ġso ci o - ec om ics Ġand Ġthe Ġlike . ĠS egm ant ation Ġcan Ġbe Ġdone Ġby Ġapp lying Ġanalytical Ġmethods Ġsuch Ġas ĠK - M eans Ġand Ġ H ier archical Ġclustering . Ġ",Ġway Ġto Ġcreate Ġstudent Ġpersonas Ġit Ġis Ġto Ġidentify Ġpossible Ġshared Ġchallenges Ġamong Ġthe Ġtarget Ġgroup Ġ ( actual Ġstudents ) Ġand Ġuse Ġthese Ġchallenges Ġas Ġstart ing Ġpoints Ġupon Ġwhich Ġto Ġcreate Ġthe Ġpersonas ' Ġprofiles . ĠĊ Ċ S orry Ġbut Ġthe Ġform ulation Ġof Ġthis Ġquestion Ġis Ġtoo Ġcom plic ated Ġso ĠI Ġam Ġnot Ġeven Ġsure Ġwhat Ġit Ġis Ġask ed Ġ ( ex pl ations Ġbefore Ġthe Ġsurvey Ġdid Ġnot Ġhelp Ġe ith er ),"1 ) ĠI Ġhave Ġnot Ġbeen Ġteaching Ġmarketing Ġcourses . Ġ Ċ 2 ) ĠI Ġhave Ġnot Ġparticipated Ġin Ġmarketing Ġcourses Ġas Ġstudent . ĠM y Ġbackground Ġis Ġdifferent . ĠI Ġfeel Ġthat Ġthese Ġt w o Ġaspects Ġwere Ġtaken Ġfor Ġgr ant ed Ġin Ġyour Ġquestions . Ċ N , Ġthe Ġevaluation Ġof Ġpersonas Ġin Ġterms Ġof Ġaccuracy Ġand Ġusefulness Ġcan Ġbe Ġdone Ġby Ġcomparing Ġthe Ġpersonas ' Ġprofiles Ġwith Ġtheir Ġrele van ce Ġin Ġreal Ġlife Ġphenomen . Ġ Ġway Ġto Ġfind Ġout Ġis Ġto Ġcont r ast Ġwhether Ġany Ġmarketing Ġc amp ign s Ġbased Ġon Ġthese Ġpersonas Ġare Ġeffective Ġ ( e . g . Ġle ad ing Ġto Ġexpect ed Ġor Ġhigh er Ġs al es ) . ĠĠ",2,2,All of the above,0,1,0,0,Ġillustr ate Ġ ( Ġupdate ) Ġstatic Ġpersona Ġprofiles .,Ġhave Ġno Ġclue Ġwhat Ġis ĠAPI .,Ġcreate Ġdynamic Ġpersonas . Ġ,4,2,4,4,2,4,4,2,2,6
2/13/25 0:09,2/13/25 0:17,193.166.113.31,462,R_8tHW5RDZd4yBkcx,63.1198,21.6798,0,0,22,45,1,2,1,3,"1,3","3,4","3,4","2,3,4",11,10,"1,3",1,5,2,5,Ġdon ' t Ġknow .,Ġ Ä ł don Ġ ' t Ġ Ä ł k Ġ Ä ł w hat Ġ Ä ł PI Ġ Ä ł st s Ġ Ä ł Ġ .,Ġ Ä ł don Ġ ' t Ġ Ä ł k Ġ .,Ġdon ' t Ġknow .,0,2025-02-13 10:06:34,2025-02-13 10:19:38,193.166.113.31,784,R_2kRKZFGiWHUQidw,63.1198,21.6798,0,0,"Ġneed Ġquantitative Ġdata , Ġwhich Ġcan Ġbe Ġobtained Ġthrough Ġsurveys , Ġonline Ġanalytics , Ġuser Ġbehaviour Ġdata . ĠThe Ġdata Ġshould Ġbe Ġdiverse Ġand Ġrepresentative Ġto Ġav oid Ġbi es . Ġ","S t istical Ġanalyses Ġare Ġre qu ire d . ĠThese Ġinclude Ġclustering Ġtechniques Ġ ( e . g . Ġhier ac hical Ġclustering , Ġk - means , ĠL C / LP ) . ĠThe Ġidea Ġis Ġto Ġextract Ġvar y ing Ġsegments Ġfrom Ġthe Ġdata .","Ġthis Ġstage , Ġcr af ting Ġthe Ġpersona Ġprofiles Ġcom es Ġto Ġplay . ĠThe Ġdist ction Ġbetween Ġthe Ġpersonas Ġare Ġbased Ġon Ġthe Ġvar ation Ġin Ġdata Ġused Ġfor Ġthe Ġsegmentation Ġsuch Ġas Ġbasic Ġdemographics , Ġbehavioural Ġpatterns , Ġgoals Ġand Ġchallenges . ĠG ood Ġpersona Ġshould Ġrepresent Ġthe Ġsegment , Ġit Ġalso Ġad vis ed Ġto Ġmake Ġit Ġrelatable Ġand Ġpresent Ġit Ġin Ġa Ġhuman Ġway . ĠAlso Ġvisuals Ġcan Ġbe Ġused Ġto Ġmake Ġthe Ġpersona Ġmore Ġem p hat ic ,","Ġis Ġa Ġcr u cial Ġstep Ġin Ġthe Ġpersona Ġbuilding Ġto Ġvalidate Ġthe Ġpersonas . ĠI Ġcan Ġfor Ġexample Ġcarry Ġout Ġvalidity Ġchec ks Ġagainst Ġreal Ġstudents , Ġrevis Ġthe Ġdata Ġif Ġsome Ġpersona Ġdoes n ' t Ġseem Ġrel ia ble Ġor Ġappear s Ġoutdated .",3,4,All of the above,0,2,0,1,Ġvisual ise Ġthe Ġpersona .,Ġdon t Ġknow Ġwhat ĠAPI Ġstands Ġfor .,Ġdon ' t Ġknow .,3,4,6,6,1,4,5,3,4,5
2/13/25 0:11,2/13/25 0:17,193.166.113.21,355,R_8462bTis2cTNcii,63.1198,21.6798,0,0,19,39,1,2,1,1,"1,2,3,4","3,4","3,4","2,3,4",12,1,4,1,5,2,5,nan,nan,nan,nan,0,2025-02-13 0:55:51,2025-02-13 1:11:01,193.166.113.21,909,R_2M3diy3SR17ual3,63.1198,21.6798,0,0,"Data Ġsources : ĠA t t end ance , Ġgroup Ġtasks Ġevaluation , Ġse l f Ġlearning Ġtasks Ġevalu ations , Ġ Ġclass Ġparticipation , Ġgrades , Ġinteraction Ġwith Ġf ell ow Ġstudents , Ġclass Ġroom Ġobservations , Ġ Ċ : Ġusing Ġclass Ġroom Ġinteractions , Ġresults , Ġstudent Ġengagement Ġactivities Ġ Ċ Ġmuch : Ġdata Ġthrough Ġthe Ġclass Ġperiod , Ġo ld Ġclass Ġroom Ġdata Ġas Ġwell Ġto Ġmake Ġdata Ġset Ġri gr ous","C lustering , Ġmat rix Ġfor Ġpatterns , ĠAI Ġor Ġso f t w s Ġto Ġcluster Ġindividual Ġbased Ġon Ġcertain Ġcharacteristics Ġand Ġbehaviours .",use Ġthe Ġdata Ġand Ġbuild Ġrepresentative Ġpersonas Ġfor Ġeach Ġcategor y Ġor Ġidentified Ġpattern,test Ġwith Ġthe Ġexisting Ġn et wor k Ġto Ġsee Ġif Ġthe Ġpersonas Ġrepresent Ġcertain Ġpatterns Ġthat Ġare Ġrelatable Ġto Ġgroup Ġcharacteristics . Ċ Ex ternal Ġvalidation Ġwith Ġout s ide Ġpart ies,4,5,All of the above,0,1,0,0,data Ġanalysis Ġ,Ġcollect Ġdata Ġ,Ġa Ġgre Ġde al . Ġcan Ġhelp Ġprocess Ġlarge Ġamount Ġof Ġdata Ġro Ġcreate Ġpersona,6,6,6,4,2,3,6,1,4,4
2/13/25 0:09,2/13/25 0:18,193.166.117.7,551,R_824J8ZB9ZGfOu8t,63.1198,21.6798,0,0,15,38,2,2,2,0,"1,2,4",4,"3,4",2,12,1,5,5,5,5,5,-,-,-,-,0,2025-02-13 0:55:35,2025-02-13 1:19:16,193.166.117.7,1421,R_2KPeTVjwHtRdvU7,63.1198,21.6798,0,0,"- age , Ġjobs , Ġdemographic Ġdata , Ġhow Ġthey Ġbeha ve Ġand Ġinteract Ċ - th rough Ġinterviews , Ġsurveys , Ġobservations , Ġanalytic Ġtools , ĠCRM , ĠAPI","- c lustering Ġstudents Ġaccording Ġto Ġtheir Ġgoals , Ġchallenges , Ġshared Ġinterests , Ġmotivations , Ġdemographics , Ġpsychographics , Ġbehaviors Ċ - th ere Ġwere Ġsome Ġanalytic Ġtools Ġment ions , Ġbut ĠI Ġdon ' t Ġremember Ġwhat",- ma king Ġdescriptive Ġprofile Ġposters Ġfor Ġeach Ġpersona Ġthat Ġcan Ġthen Ġbe Ġshared Ġwith Ġother Ġemploy e es,"- p ersonas Ġshould Ġnot Ġbecome Ġstatic Ġbut Ġthey Ġmust Ġbe Ġupdated Ġregularly Ġwith Ġnew Ġtrends Ġand Ġinformation , Ġwe Ġshould Ġensure Ġthat Ġthe Ġdata Ġcollected Ġis Ġnot Ġbi ased , Ġoutdated Ġor Ġother w ise Ġinc rect Ċ - Ġshould Ġtake Ġcare Ġof Ġ Ġintegr ity Ġand Ġreliability",4,2,All of the above,0,1,0,0,Ġmake Ġposters Ġof Ġthe Ġpersona Ġso Ġthat Ġevery e Ġcan Ġacc ess Ġthe Ġdata Ġ ( c om m unic ate Ġabout Ġthe Ġpersona ),Ġanalysis ? ĠI Ġdon ' t Ġknow Ġwhat Ġis ĠAPI .,Ġdevelop Ġpersonas Ġfurther Ġwhen Ġnew Ġinformation Ġbecomes Ġavailable ? ĠTo Ġextract Ġrelevant Ġinformation .,4,2,3,3,1,4,3,6,1,6
2/13/25 0:10,2/13/25 0:18,193.166.108.65,503,R_8nILfCbV7DT317z,63.1092,21.5936,0,0,13,25,2,2,2,0,"1,4",4,"3,4","2,3,4",12,10,5,1,5,2,1,-,-,-,-,0,2025-02-13 0:56:06,2025-02-13 1:21:14,193.166.108.65,1507,R_2jdOizB2yhyWoGx,63.1092,21.5936,0,0,"Ġdata Ġcollected Ġshould Ġbe Ġqualitative Ġand Ġquantitative . ĠQuantitative Ġmethods Ġof Ġthe Ġd ay Ġwould Ġinclude Ġfor Ġexample Ġdifferent Ġanalytics Ġof Ġstudents , Ġsuch Ġas Ġdemographic Ġinformation . ĠHowever , Ġqualitative Ġdata , Ġcollected Ġwith Ġinterviews , Ġan ec d ot es , Ġobservations Ġis Ġgoing Ġneeded Ġas Ġwell . ĠThe Ġdata Ġshould Ġinclude Ġfor Ġexample Ġthe Ġchallenges Ġor Ġgoals Ġof Ġstudents , Ġand Ġcap t ure Ġthe Ġkey Ġelements Ġand Ġtypical Ġbehavior Ġof Ġthe Ġstudents Ġto Ġcreate Ġa Ġrealistic Ġpersonas Ġof Ġa Ġtypical Ġmarketing Ġcourse Ġstudent . ĠPerhaps Ġalso Ġdata Ġof Ġthe Ġlearning Ġstyles Ġof Ġstudents Ġcould Ġbe Ġbeneficial Ġin Ġcreating Ġthe Ġstudent Ġpersona . ĠAlso , Ġthe Ġpersona Ġshould Ġbe Ġupdated Ġon ce Ġin Ġa Ġwh ile Ġby Ġcollecting Ġmore Ġdata Ġto Ġinclude Ġdifferent Ġtrends Ġetc . , Ġs ce Ġthey Ġcan Ġ "" ex p ire "" Ġso Ġto Ġs ay . ĠThe Ġdata Ġcollection Ġshould , Ġhowever , Ġreg ar d Ġthe Ġle g al Ġaspects , Ġsuch Ġas ĠG D P R .","Ġdata Ġwould Ġbe Ġsegmented Ġbased Ġon Ġthe Ġkey Ġcharacteristics Ġof Ġthe Ġstudents , Ġfor Ġexample Ġutil izing Ġanalytical Ġmethods , Ġsuch Ġas ĠM rix Ġfact oring Ġand Ġcluster Ġanalysis Ġto Ġseparate Ġdifferent Ġgroups Ġof Ġlearners Ġfrom Ġeach Ġother . ĠSo , Ġto Ġseparate Ġthe Ġuser Ġtypes Ġand Ġtailor Ġthe Ġpersona Ġto Ġthem .","Ġpersona Ġprofiles Ġshould Ġbe Ġb rie f Ġsummar ies Ġof Ġthe Ġkey Ġcharacteristics Ġof Ġstudents Ġ- Ġfor Ġexample Ġone Ġs l ide Ġor ĠA 4 Ġof Ġdescription Ġwith Ġa Ġpicture Ġma d e Ġwith ĠC anva Ġor Ġother Ġtool . ĠThe Ġprofiles Ġcan Ġbe Ġcreated Ġe . g . Ġby Ġgiving Ġthe Ġpersonas Ġnames , Ġback st ories , Ġincluding Ġthe Ġgoals Ġand Ġthe Ġchallenges Ġof Ġthe Ġpersona Ġ- Ġand Ġth Ġmaking Ġthem Ġmore Ġhuman - like . ĠThis Ġincludes Ġalso Ġtheir Ġtypical Ġbehavior .","Ġevaluation Ġof Ġthe Ġpersona Ġshould Ġbe Ġdone Ġintern ally Ġand Ġex tern ally . ĠIn ternal Ġtesting Ġmean ing Ġanalytical Ġtest s Ġand Ġexternal Ġe . g . Ġuser Ġtesting Ġor ĠA / B - test ing . ĠThe Ġ Ġquality Ġof Ġthe Ġdata Ġplay s Ġa Ġbig Ġro le Ġin Ġhere , Ġbecause Ġfrom Ġlacking Ġdata Ġyou Ġcannot Ġcreate Ġa Ġsu fficient Ġstudent Ġpersona Ġthat Ġwould Ġwork Ġin Ġreal - life Ġsituation , Ġsuch Ġas Ġin Ġclassroom . ĠR eas ons Ġfor Ġpo Ġdata Ġmi ght Ġbe Ġover Ġrel ance Ġto Ġquantitative Ġdata . Ġ",4,3,All of the above,0,1,0,0,Ġcan Ġbe Ġused Ġto Ġcreate Ġpersona Ġdescriptions .,Ġdata Ġcollection .,Ġdata Ġcollection .,3,2,6,4,1,2,6,4,3,6
2/13/25 0:10,2/13/25 0:19,85.76.76.143,518,R_2dXtd952juNtA5k,60.2149,24.799,0,0,7,47,2,3,2,0,"1,3","3,4",3,"2,3,4",13,1,5,1,5,5,5,Ġdon ' t Ġknow,Ġ Ä ł ide,beats Ġ Ä ł m e,"Et hical . ĠFor Ġpeople Ġit Ġis Ġdifficult Ġto Ġremember Ġthat Ġm ach es Ġact ing Ġlike Ġpeople Ġare Ġnot Ġreal Ġpeople , Ġbut Ġcan Ġbe Ġused Ġfor Ġman ip ulation Ġby Ġother Ġpeople .",0,2025-02-13 0:55:44,2025-02-13 1:25:36,85.76.76.143,1792,R_2Vr512AJd8swyeX,60.2149,24.799,0,0,"M ult ple Ġkind s Ġof Ġdata Ġcan Ġand Ġshould Ġbe Ġused , Ġsuch Ġas Ġuser Ġanalytics , Ġmarket Ġsurveys , Ġsocial Ġmedia Ġmetrics , Ġobservations , Ġinterviews , Ġfocus Ġgroups . ĠIt Ġgood Ġto Ġhave Ġboth Ġmeas ur able Ġmetrics Ġ ( . e . Ġquantitative ) Ġwhich Ġis Ġusually Ġmore Ġtypical , Ġand Ġalso Ġen r ich Ġthat Ġwith Ġqualitative Ġresearch Ġdata . ĠThe Ġdata Ġshould Ġbe Ġrevis ited Ġand Ġref s d Ġthrough Ġtime Ġso Ġthat Ġthe Ġpersonas Ġdo Ġnot Ġbecome Ġstatic . ĠIn Ġa Ġstudent Ġpersona Ġcase Ġfor Ġa Ġmarketing Ġcourse Ġthe Ġdata Ġcollected Ġcould Ġcover Ġall Ġread ily Ġavailable Ġdata Ġon Ġthe Ġmarketing Ġstudents Ġat ĠV . ĠHowever , Ġas ĠI Ġam Ġnot Ġdo ing Ġany Ġteaching Ġassignments Ġin Ġthe Ġuniversity , ĠI Ġdon ' t Ġknow Ġwhat Ġare Ġthe Ġactual Ġdata Ġsources Ġthat Ġcould Ġbe Ġapplied Ġin Ġthis Ġcase . ĠHowever , Ġthe Ġkey Ġinfo Ġthat Ġshould Ġbe Ġobtained Ġare Ġe . g . Ġstudy Ġgoals Ġ & Ġspecific Ġchallenges , Ġlearning Ġpreferences , Ġcourses Ġse lect ed , Ġcareer Ġpl ans Ġetc . , Ġpersonal Ġinformation Ġe . g . Ġage , Ġgender Ġ ( demographics )","Ġdata Ġcan Ġbe Ġanalys ed Ġusing Ġdifferent Ġclustering Ġmethods , Ġsuch Ġas ĠK - means Ġor Ġhier archical Ġclustering , Ġin Ġorder Ġto Ġhave Ġdemographic , Ġpsychographic Ġand Ġbehavioural Ġsegments Ġsynthe s ized Ġout Ġof Ġthe Ġdata . ĠAlso ĠNLP Ġcould Ġbe Ġused .","Ġsegments Ġcan Ġbe Ġthen Ġt ur n ed Ġinto Ġpersona Ġprofiles Ġusing Ġp owerpoint Ġor Ġcanva . ĠThe Ġpersona Ġis Ġgiven Ġan Ġactual Ġcharacter Ġwith Ġa Ġname Ġand Ġa Ġprofile Ġpicture , Ġincluding Ġall Ġthe Ġconden s ed Ġinfo Ġcharacter izing Ġthe Ġkey Ġaspects Ġrelated Ġto Ġmarketing Ġcourse Ġstudent Ġsegments . ĠThese Ġcould Ġbe Ġage , Ġgender , Ġlearning Ġgoals , Ġstudy Ġstyle , Ġspecific Ġmotivations Ġand Ġchallenges .","Ġevaluation Ġshould Ġcover Ġinternal Ġ & Ġexternal Ġvalid ations , Ġsuch Ġas ĠA / B Ġtesting . ĠĠ",4,5,All of the above,0,1,0,0,Ġcreating Ġthe Ġpersona Ġprofiles .,Ġdata Ġcollection .,Ġpersona Ġprofile Ġcreation Ġfrom Ġall Ġthe Ġdata .,4,4,3,4,2,2,3,5,2,7
2/13/25 0:11,2/13/25 0:19,193.166.113.6,487,R_2DYADIupQ1S6J8F,63.1198,21.6798,0,0,12,39,2,2,1,5,3,3,3,4,12,1,5,1,5,2,5,Ġidea .,Ġ Ä ł ide Ġ .,Ġ Ä ł ide Ġ .,Ġidea .,0,2025-02-13 10:06:47,2025-02-13 10:21:16,193.166.113.6,868,R_2JEZZFhi751EYmw,63.1198,21.6798,0,0,"Ġcould Ġcollect Ġfor Ġexample Ġdemographic Ġdata Ġsuch Ġas Ġage , Ġgender Ġand Ġlocation Ġof Ġthe Ġtarget Ġg ou p , Ġbehavioural Ġdata Ġsuch Ġas Ġeducational Ġbackground Ġand Ġacademic Ġand Ġcareer Ġinterests , Ġbackground Ġin Ġmarketing , Ġlearning Ġpreferences . ĠYou Ġcould Ġalso Ġuse Ġa Ġsurvey Ġto Ġcollect Ġinformation Ġon Ġthe Ġmotivations , Ġgoals Ġchallenges Ġand Ġemot ions Ġthat Ġthe Ġtarget Ġgroup Ġas ci ates Ġwith Ġthe Ġcourse . Ġ Y Ġaim Ġis Ġto Ġcollect Ġdata Ġto Ġbe Ġable Ġto Ġdescribe Ġ "" Ġtypical Ġstudent "" .","Ġguess Ġyou Ġcould Ġuse Ġjust Ġbasic Ġstatistical Ġmethods Ġyou Ġwould Ġuse Ġfor Ġsegmentation Ġin Ġgeneral . ĠBut Ġin Ġthe Ġstudy Ġmaterial Ġsome Ġspecific Ġmore Ġadvanced Ġmethods Ġthat Ġwere Ġnew Ġto Ġme , Ġsuch Ġas Ġnon - n e g ative Ġmet rix Ġfact ization Ġand Ġel b ow Ġapp ro ach Ġwere Ġment ion ed . ĠBut Ġto Ġbe Ġable Ġto Ġunderstand Ġwhat Ġthose Ġare Ġand Ġto Ġbe Ġable Ġto Ġuse Ġthem , ĠI Ġwould Ġneed Ġto Ġstudy Ġa Ġlot Ġmore .","Ġbasic ly Ġsynthe z ise Ġthe Ġkey Ġattributes Ġof Ġthe Ġsegments Ġto Ġcreate Ġa Ġv ivid Ġhuman - like Ġdescription Ġof Ġa Ġfict ional Ġpersona Ġof Ġ1 Ġto Ġ2 Ġpages . ĠIn Ġaddition Ġto Ġsyn te z ing , Ġyou Ġcan Ġgive Ġthe Ġpersona Ġa Ġname , Ġa Ġpicture , Ġand Ġthen Ġdescribe Ġits Ġbackground , Ġgoals , Ġfeel ings Ġetc . ĠYou Ġcan Ġcreate Ġa Ġnarr ative Ġon Ġthe Ġstudy Ġj n ey Ġor Ġthis Ġim ag ative Ġstudent .",Ġkey Ġof Ġevaluating Ġthe Ġaccur en ess Ġof Ġthe Ġpersonas Ġis Ġuser Ġfeedback . ĠIn Ġorder Ġto Ġget Ġthis Ġfeed - Ġyou Ġcan Ġuse Ġboth Ġquantitative Ġand Ġqualitative Ġmethods . ĠYou Ġcan Ġalso Ġcomp Ġthe Ġprofiles Ġwith Ġre el Ġuser Ġanalytics .,4,5,"Surveys and interviews,Behavioral data from apps",0,2,0,1,Maybe Ġfor Ġsyn s izing Ġthe Ġdata Ġand Ġcreating Ġthe Ġdocument Ġto Ġdescribe Ġthe Ġpersona .,Ġidea .,Maybe Ġfor Ġcomparing Ġthe Ġpersonas Ġwith Ġreal Ġuser Ġanalytics Ġand Ġen han c ing Ġthem .,6,6,6,6,2,6,6,2,5,6
2/13/25 0:09,2/13/25 0:19,193.166.108.69,632,R_8m1Ou9kltVx56Vz,63.1092,21.5936,0,0,4,44,1,1,1,12,"2,3","3,4",4,"2,4",12,10,4,1,2,2,1,Ġidea .,Ġ Ä ł ide Ġ .,Ġ Ä ł l p Ġ Ä ł e v ol ve Ġ Ä ł Ġ Ä ł u p d ate Ġ Ä ł based Ġ Ä ł Ġ Ä ł e Ġ ' s Ġ Ä ł t ar Ġ Ä ł ud ience Ġ Ä ł Ġ Ä ł n iche Ġ Ä ł c ons um er Ġ Ä ł base Ġ . Ġ Ä ł,"- ĠYou Ġneed Ġto Ġhave Ġthe Ġcorrect Ġtarget Ġniche Ġfor Ġpersona Ġto Ġbe Ġeffective . Ġ Ċ - Ġ U nders tand ing Ġthe Ġchallenges Ġand Ġp ain Ġpoints Ġof Ġyour Ġtarget Ġniche Ġand Ġthat Ġthe Ġpersona Ġreflects Ġthose Ġaccurate ly . Ġ Ċ - ĠM eas uring Ġeff ect iveness Ċ - Ev ol ving Ġand Ġchan ging Ġconsumer Ġneeds Ġ Ċ - ir Ġare Ġmore Ġthan Ġa Ġs ing le Ġpersona Ġthat Ġany Ġone Ġb r Ġor Ġcompany Ġneeds , Ġso Ġthere Ġis Ġa Ġlot Ġto Ġman age . Ġ",0,2025-02-13 10:06:36,2025-02-13 10:25:03,193.166.108.69,1106,R_8hSk7lSbck7nRfu,63.1092,21.5936,0,0,"Ġdata Ġto Ġcollect : Ġ1 ) Ġyou Ġneed Ġdemographic Ġinformation Ġ ( age , Ġgender , Ġlocation , Ġetc . ) ; Ġ2 ) Ġstudent Ġbackground Ġ ( ma jor , Ġprevious Ġeducation , Ġetc . ) ; Ġ3 ) Ġbehavioral Ġdata Ġ ( c ourse Ġparticipation , Ġonline Ġinteractions ) ; Ġ 4 ) Ġpreferences Ġ ( le arning Ġstyles , Ġcontent Ġengagement , Ġetc . ) . Ċ Ġto Ġcollect : Ġyou Ġcan Ġuse : Ġ1 ) utom ated Ġsystem s Ġof Ġevol ving Ġonline Ġinteractions ; Ġ2 ) Ġsocial Ġmedia Ġanalytics ; Ġor , Ġ3 ) Ġfocus Ġgroups . Ġ Ċ Ġmuch : Ġthe Ġsample Ġneeds Ġto Ġbe Ġlarge Ġenough Ġto Ġprodu ce Ġstatistically Ġsignificant Ġdata Ġto Ġensure Ġrepresentativeness . Ġ","Ġcan Ġsegment Ġthe Ġdata Ġon Ġattributes Ġvia : Ġ1 ) Ġclustering Ġbehaviors Ġand Ġdemographics Ġ ( e . g . , Ġage ) ; Ġ2 ) Ġstatistical Ġalgorithms Ġto Ġidentify Ġpatterns Ċ Ċ Ġneed Ġdiverse Ġsegments Ġthat Ġare Ġillustr ative Ġof Ġthe Ġr ge Ġof Ġstudents . ĠĠ","Ġneed Ġa Ġpersona Ġto Ġen c ap s ul ate Ġthe Ġneeds Ġand Ġcharacteristics Ġof Ġthe Ġgroup , Ġgive Ġeach Ġpersona Ġa Ġname , Ġimage Ġand Ġdetail ed Ġdescriptions Ġof Ġgoals Ġand Ġpatterns Ġof Ġbehavior . ĊĊ","Ġneeds Ġto Ġtest Ġpersonas Ġwith Ġreal Ġdec ions Ġand Ġfeedback . - Ġask Ġstudents Ġor Ġst ake ho ld ers Ġto Ġvalidate Ġpersona Ġagainst Ġexperiences . ĠYou Ġneed Ġcontinuous Ġdata Ġcollection Ġand Ġevaluation Ġbecause Ġdemographics Ġand Ġbehavior Ġpatterns Ġchange . ĠĊ Ċ Personas Ġare Ġimportant Ġbecause Ġthey Ġcan Ġhelp Ġa Ġteacher Ġcreate : Ġpsychological Ġengagement Ġ ( em p hy Ġto w ar ds Ġhow Ġstudents Ġlearn ) ; Ġfocus Ġon Ġuser Ġgoals Ġin Ġteaching ; Ġchallen ge Ġassumptions Ġ ( . e . , Ġchallen g er Ġteacher Ġassumptions Ġof Ġstudents ) ; ĠP rom ote Ġincl ivity ; Ġand , Ġf ac il ate Ġuser - c ent ered Ġdesign . ĠĠ",2,3,All of the above,0,1,0,0,"P os sibly , Ġbegin Ġto Ġ rough ly Ġbuild Ġan Ġimage Ġand Ġdescription Ġof Ġindividual Ġpersona Ġsegments Ġduring Ġanalysis . Ġ","pos sibly Ġtrack Ġuser Ġpatterns , Ġdemographics Ġand Ġpreferences . Ġ","Ġcan Ġhelp Ġcollect Ġbehavioral Ġdata Ġand Ġpreferences Ġas Ġwell Ġas Ġdevelop Ġcl ust ers Ġof Ġdata Ġon Ġbehaviors Ġand Ġdemographics . ĠAlso , Ġlike ly Ġhelp Ġto Ġdevelop Ġstatistically Ġsignificant Ġpatterns Ġin Ġsegmentation . Ġ",5,6,6,3,1,6,5,2,4,2
2/13/25 0:10,2/13/25 0:20,193.166.113.43,599,R_83pqGRKBhCMAliU,63.1198,21.6798,0,0,25,61,4,2,2,10,3,4,4,3,10,1,5,5,5,5,5,"Ġdon ' t Ġknow , Ġpls Ġtell Ġme","Ġ Ä ł don Ġ ' t Ġ Ä ł k Ġ , Ġ Ä ł pl s Ġ Ä ł t ell Ġ Ä ł m e","Ġ Ä ł don Ġ ' t Ġ Ä ł k Ġ , Ġ Ä ł pl s Ġ Ä ł t ell Ġ Ä ł m e","Ġdon ' t Ġknow , Ġpls Ġtell Ġme",0,2025-02-13 0:56:12,2025-02-13 1:08:27,193.166.113.43,735,R_8QmNSUbmrzjvVS6,63.1198,21.6798,0,0,"d ep ends Ġon Ġfor Ġwhat Ġpur p ose , Ġo k Ġmarketing , Ġbut Ġmarketing Ġwhat ? Ġsounds Ġa Ġl t le Ġ "" t un te le va ista "" Ġto Ġcollect Ġevery th ing Ġfor Ġ "" Ġuse "" Ċ = > Ġi Ġdon ' t Ġknow",?,"s orry , ĠI Ġhave Ġdifficult ies Ġto Ġcont ribut e Ġon Ġthis , ĠThe Ġcon te x Ġis Ġso Ġw ide , Ġit Ġneeds Ġlimit ations","s ame Ġiss ue , Ġif Ġyou Ġwant Ġto Ġse ll Ġa Ġcar Ġto Ġthem Ġor Ġmarket Ġa Ġre sta ur ant , Ġit Ġwould Ġbe Ġmore Ġaccurate . Ġbut Ġif Ġyou Ġjust Ġcollect Ġthe Ġdata Ġfor Ġr om ? ?",2,2,Skip. I do not know,0,0,0,0,?,ap Ġclasses Ġare Ġfor Ġo il Ġgr u op ing Ġ ( er ic Ġp et ro le um Ġind ustr y ) . Ġ,?,5,2,5,5,5,5,5,3,3,4
